Symbol,Name,Market Cap,Country,IPO Year,Volume,Sector,Industry
CURIW,CuriosityStream Inc. Warrant,927529,United States,2020,52655,Consumer Discretionary,Movies/Entertainment
CURV,Torrid Holdings Inc. Common Stock,448604040,,2021,25462,Consumer Discretionary,Clothing/Shoe/Accessory Stores
CUTR,Cutera Inc. Common Stock,44112975,United States,2004,2355627,Health Care,Biotechnology: Electromedical & Electrotherapeutic Apparatus
CUZ,Cousins Properties Incorporated Common Stock,3349635936,United States,,1202364,Real Estate,Real Estate Investment Trusts
CVAC,CureVac N.V. Ordinary Shares,593180240,Germany,2020,944048,Health Care,Biotechnology: Pharmaceutical Preparations
CVBF,CVB Financial Corporation Common Stock,2242528818,United States,,740678,Finance,Major Banks
CVCO,Cavco Industries Inc. Common Stock When Issued,3091837706,United States,,65261,Consumer Discretionary,Homebuilding
CVE,Cenovus Energy Inc Common Stock,38356363828,Canada,,13204704,Energy,Oil & Gas Production
CVEO,Civeo Corporation (Canada) Common Shares,375399338,,2014,39950,,
CVGI,Commercial Vehicle Group Inc. Common Stock,214915678,United States,2004,73590,Consumer Discretionary,Auto Parts:O.E.M.
CVGW,Calavo Growers Inc. Common Stock,438598530,United States,,123155,Consumer Discretionary,Specialty Foods
CVI,CVR Energy Inc. Common Stock,3469310971,United States,2007,589337,Energy,Integrated oil Companies
CVII,Churchill Capital Corp VII Class A Common Stock,0,United States,,2072,Finance,Blank Checks
CVIIU,Churchill Capital Corp VII Units,,United States,,3,Finance,Blank Checks
CVIIW,Churchill Capital Corp VII Warrants,,United States,,61398,Finance,Blank Checks
CVKD,Cadrenal Therapeutics Inc. Common Stock,6483430,United States,2023,144580,Health Care, Medicinal Chemicals and Botanical Products 
CVLG,Covenant Logistics Group Inc. Class A Common Stock,588741126,United States,,47604,Industrials,Trucking Freight/Courier Services
CVLT,Commvault Systems Inc. Common Stock,4115107779,United States,2006,454358,Technology,Computer Software: Prepackaged Software
CVLY,Codorus Valley Bancorp Inc Common Stock,206353117,United States,,12114,Finance,Savings Institutions
CVM,Cel-Sci Corporation Common Stock,79665727,United States,1997,175064,Health Care,Biotechnology: Biological Products (No Diagnostic Substances)
CVNA,Carvana Co. Class A Common Stock,14098621206,United States,2017,5889992,Consumer Discretionary,Other Specialty Stores
CVR,Chicago Rivet & Machine Co. Common Stock,14975046,United States,1930,2853,Industrials,Industrial Machinery/Components
CVRX,CVRx Inc. Common Stock,348028133,United States,2021,101376,Health Care,Biotechnology: Electromedical & Electrotherapeutic Apparatus
CVS,CVS Health Corporation Common Stock,86782681175,United States,,7233874,Consumer Staples,Retail-Drug Stores and Proprietary Stores
CVU,CPI Aerostructures Inc. Common Stock,34835500,United States,2022,113121,Industrials,Military/Government/Technical
CVV,CVD Equipment Corporation Common Stock,32757653,United States,,16017,Technology,Industrial Machinery/Components
CVX,Chevron Corporation Common Stock,2.92687E+11,United States,,7229743,Energy,Integrated oil Companies
CW,Curtiss-Wright Corporation Common Stock,9441764648,United States,,126074,Industrials,Industrial Machinery/Components
CWAN,Clearwater Analytics Holdings Inc. Class A Common Stock,3949434436,United States,2021,1106485,Technology,Computer Software: Prepackaged Software
CWBC,Community West Bancshares Common Stock,160099744,United States,,45069,Finance,Major Banks
CWCO,Consolidated Water Co. Ltd. Ordinary Shares,385257319,Cayman Islands,,156379,Utilities,Water Supply
CWD,CaliberCos Inc. Class A Common Stock,19151589,United States,2023,25356,Finance,Real Estate
CWEN,Clearway Energy Inc. Class C Common Stock,2631449062,United States,2015,1036389,Utilities,Electric Utilities: Central
CWH,Camping World Holdings Inc. Class A Common Stock,1939302592,United States,2016,1049409,Consumer Discretionary,Retail-Auto Dealers and Gas Stations
CWK,Cushman & Wakefield plc Ordinary Shares,2177821687,,2018,1293947,Finance,Real Estate
CWST,Casella Waste Systems Inc. Class A Common Stock,5546687038,United States,1997,279294,Utilities,Environmental Services
CWT,California Water Service Group Common Stock,2560201196,United States,,381357,Utilities,Water Supply
CX,Cemex S.A.B. de C.V. Sponsored ADR,12357670685,Mexico,,3831988,Industrials,Building Materials
CXAI,CXApp Inc. Class A Common Stock,64526065,United States,2021,1747378,Technology,EDP Services
CXAIW,CXApp Inc. Warrant,5644124,United States,2021,240484,Technology,EDP Services
CXDO,Crexendo Inc. Common Stock,115650489,United States,,198330,Telecommunications,Telecommunications Equipment
CXE,MFS High Income Municipal Trust Common Stock,110182577,United States,1989,50376,Finance,Investment Managers
CXH,MFS Investment Grade Municipal Trust Common Stock,67233608,United States,1989,13329,Finance,Investment Managers
CXM,Sprinklr Inc. Class A Common Stock,3100811215,United States,2021,2023277,Technology,Computer Software: Prepackaged Software
CXT,Crane NXT Co. Common Stock,3474923455,United States,,425448,Industrials,Metal Fabrications
CXW,CoreCivic Inc. Common Stock,1711642740,United States,,328423,Real Estate,Real Estate Investment Trusts
CYBN,Cybin Inc. Common Shares,95137464,Canada,,2824097,Health Care,Pharmaceuticals and Biotechnology
CYBR,CyberArk Software Ltd. Ordinary Shares,10138745320,Israel,2014,668944,Technology,Computer Software: Prepackaged Software
CYCC,Cyclacel Pharmaceuticals Inc. Common Stock,2069663,United States,,38766,Health Care,Biotechnology: Pharmaceutical Preparations
CYCCP,Cyclacel Pharmaceuticals Inc. 6% Convertible Preferred Stock,23333149,United States,,250,Health Care,Biotechnology: Pharmaceutical Preparations
CYCN,Cyclerion Therapeutics Inc. Common Stock,8997519,United States,,2358,Health Care,Biotechnology: Pharmaceutical Preparations
CYD,China Yuchai International Limited Common Stock,337080893,Singapore,1994,9776,Industrials,Industrial Machinery/Components
CYH,Community Health Systems Inc. Common Stock,410211498,United States,2000,1806838,Health Care,Hospital/Nursing Management
CYN,Cyngn Inc. Common Stock,9323131,United States,2021,5282115,Technology,EDP Services
CYRX,CryoPort Inc. Common Stock,833596642,United States,,478732,Health Care,Biotechnology: Pharmaceutical Preparations
CYTH,Cyclo Therapeutics Inc. Common Stock,35607518,United States,,21914,Health Care,Biotechnology: Pharmaceutical Preparations
CYTHW,Cyclo Therapeutics Inc. Warrant,8327565,United States,,420,Health Care,Biotechnology: Biological Products (No Diagnostic Substances)
CYTK,Cytokinetics Incorporated Common Stock,7004320280,United States,2004,1516943,Health Care,Biotechnology: Pharmaceutical Preparations
CYTO,Altamira Therapeutics Ltd. Common Shares,2453123,Bermuda,2014,120597,Health Care,Biotechnology: Pharmaceutical Preparations
CZFS,Citizens Financial Services Inc. Common Stock,209696583,United States,,2482,Finance,Major Banks
CZNC,Citizens & Northern Corp Common Stock,263580034,United States,,19992,Finance,Major Banks
CZOO,Cazoo Group Ltd Class A Ordinary Shares,2876476,,,328938,Consumer Discretionary,Retail-Auto Dealers and Gas Stations
CZR,Caesars Entertainment Inc. Common Stock,8699576669,United States,,3292771,Consumer Discretionary,Hotels/Resorts
CZWI,Citizens Community Bancorp Inc. Common Stock,114921111,United States,2006,17358,Finance,Savings Institutions
D,Dominion Energy Inc. Common Stock,40130280875,United States,,4413868,Utilities,Electric Utilities: Central
DAC,Danaos Corporation Common Stock,1405525216,Greece,2006,78433,Consumer Discretionary,Marine Transportation
DADA,Dada Nexus Limited American Depositary Shares,482858733,China,2020,1056275,Technology,Computer Software: Programming Data Processing
DAIO,Data I/O Corporation Common Stock,33205376,United States,1981,16299,Industrials,Electrical Products
DAKT,Daktronics Inc. Common Stock,411546761,United States,1994,360110,Consumer Discretionary,Miscellaneous manufacturing industries
DAL,Delta Air Lines Inc. Common Stock,30103818002,United States,,12117099,Consumer Discretionary,Air Freight/Delivery Services
DALN,DallasNews Corporation Series A Common Stock,20500037,United States,,16820,Consumer Discretionary,Newspapers/Magazines
DAN,Dana Incorporated Common Stock ,1721086889,United States,,1897504,Consumer Discretionary,Auto Parts:O.E.M.
DAO,Youdao Inc. American Depositary Shares each representing one Class A Ordinary Share,475469941,China,2019,82837,Real Estate,Other Consumer Services
DAR,Darling Ingredients Inc. Common Stock,6885633035,United States,1997,1526432,Consumer Staples,Packaged Foods
DARE,Dare Bioscience Inc. Common Stock,48289370,United States,2014,203551,Health Care,Biotechnology: Pharmaceutical Preparations
DASH,DoorDash Inc. Class A Common Stock,53692159642,United States,,2775701,Industrials,Industrial Machinery/Components
DATS,DatChat Inc. Common Stock,3520915,United States,2021,27530,Technology,Computer Software: Prepackaged Software
DAVA,Endava plc American Depositary Shares (each representing one Class A Ordinary Share),1767180263,United Kingdom,2018,807405,Technology,EDP Services
DAVE,Dave Inc. Class A Common Stock,428730419,United States,,60635,Technology,Retail: Computer Software & Peripheral Equipment
DAVEW,Dave Inc. Warrants,507916,United States,,7276,Technology,Retail: Computer Software & Peripheral Equipment
DAWN,Day One Biopharmaceuticals Inc. Common Stock,1210280256,United States,2021,611575,Health Care,Biotechnology: Pharmaceutical Preparations
DAY,Dayforce Inc. Common Stock,9344322000,United States,2018,1139777,Technology,Computer Software: Prepackaged Software
DB,Deutsche Bank AG Common Stock,31640400000,Germany,,3196746,Finance,Major Banks
DBD,Diebold Nixdorf Incorporated Common stock,1243457042,United States,2023,105663,Technology,EDP Services
DBGI,Digital Brands Group Inc. Common Stock,3431436,United States,2021,159856,Consumer Discretionary,Clothing/Shoe/Accessory Stores
DBGIW,Digital Brands Group Inc. Warrant,5147154,United States,2021,1,Consumer Discretionary,Clothing/Shoe/Accessory Stores
DBI,Designer Brands Inc. Class A Common Stock,482537103,United States,,1466015,Consumer Discretionary,Clothing/Shoe/Accessory Stores
DBL,DoubleLine Opportunistic Credit Fund Common Shares of Beneficial Interest,0,United States,2012,79853,,
DBRG,DigitalBridge Group Inc.,2971875819,United States,2014,1845568,Real Estate,Real Estate Investment Trusts
DBRG^H,DigitalBridge Group Inc. 7.125% Series H ,,United States,,11649,,
DBRG^I,DigitalBridge Group Inc. 7.15% Series I ,,United States,,20535,,
DBRG^J,DigitalBridge Group Inc. 7.125% Series J ,,United States,,20246,,
DBVT,DBV Technologies S.A. American Depositary Shares,134040160,France,2014,26064,Health Care,Biotechnology: Pharmaceutical Preparations
DBX,Dropbox Inc. Class A Common Stock,7884116901,United States,2018,3213124,Technology,Computer Software: Prepackaged Software
DC,Dakota Gold Corp. Common Stock,233292486,United States,2022,210361,Basic Materials,Precious Metals
DCBO,Docebo Inc. Common Shares,1372726389,Canada,,57711,Technology,Computer Software: Prepackaged Software
DCF,BNY Mellon Alcentra Global Credit Income 2024 Target Term Fund Inc. Common Stock,0,,2017,37169,Finance,Finance/Investors Services
DCFC,Tritium DCFC Limited Ordinary Shares,3245633,Australia,,32675,Technology,Electronic Components
DCFCW,Tritium DCFC Limited Warrant,16904,Australia,,3057,Technology,Electronic Components
DCGO,DocGo Inc. Common Stock,338556949,United States,2020,1070478,Health Care,Managed Health Care
DCI,Donaldson Company Inc. Common Stock,8720743251,United States,,302598,Industrials,Pollution Control Equipment
DCO,Ducommun Incorporated Common Stock,810827109,United States,,69067,Industrials,Military/Government/Technical
DCOM,Dime Community Bancshares Inc. Common Stock,712475101,United States,,277478,Finance,Major Banks
DCOMP,Dime Community Bancshares Inc. Fixed-Rate Non-Cumulative Perpetual Preferred Stock Series A,658427944,United States,,6729,Finance,Major Banks
DCPH,Deciphera Pharmaceuticals Inc. Common Stock,1203920924,United States,2017,575344,Health Care,Biotechnology: Pharmaceutical Preparations
DCTH,Delcath Systems Inc. Common Stock,119620310,United States,,182196,Health Care,Medical/Dental Instruments
DD,DuPont de Nemours Inc. Common Stock,30667285532,United States,2017,1813642,Industrials,Major Chemicals
DDC,DDC Enterprise Limited Class A Ordinary Shares,26497680,,2023,16529,Basic Materials,Metal Mining
DDD,3D Systems Corporation Common Stock,471022193,United States,,3429935,Technology,Computer peripheral equipment
DDI,DoubleDown Interactive Co. Ltd. American Depository Shares,485623712,South Korea,2021,12708,Technology,EDP Services
DDL,Dingdong (Cayman) Limited American Depositary Shares (each two representing three Ordinary Shares),271426708,Cayman Islands,2021,143246,Consumer Discretionary,Catalog/Specialty Distribution
DDOG,Datadog Inc. Class A Common Stock,41756400143,United States,2019,3845107,Technology,Computer Software: Prepackaged Software
DDS,Dillard's Inc. Common Stock,6526276665,United States,,97749,Consumer Discretionary,Department/Specialty Retail Stores
DDT,Dillard's Capital Trust I,414191591,United States,,20368,Consumer Discretionary,Department/Specialty Retail Stores
DE,Deere & Company Common Stock,1.09617E+11,United States,,1352763,Industrials,Industrial Machinery/Components
DEA,Easterly Government Properties Inc. Common Stock,1154561039,United States,2015,756548,Real Estate,Real Estate Investment Trusts
DEC,Diversified Energy Company plc Ordinary Shares,648459912,,,372351,,
DECA,Denali Capital Acquisition Corp. Class A Ordinary Shares,0,United States,2022,64858,Finance,Blank Checks
DECAW,Denali Capital Acquisition Corp. Warrant,0,United States,2022,800,Finance,Blank Checks
DECK,Deckers Outdoor Corporation Common Stock,20929353224,United States,1993,481033,Consumer Discretionary,Shoe Manufacturing
DEI,Douglas Emmett Inc. Common Stock,2163860326,United States,2006,1582239,Real Estate,Real Estate Investment Trusts
DELL,Dell Technologies Inc. Class C Common Stock ,84091639366,United States,2018,6755270,Technology,Computer Manufacturing
DENN,Denny's Corporation Common Stock,433705868,United States,,860495,Consumer Discretionary,Restaurants
DEO,Diageo plc Common Stock,76729042095,United Kingdom,,1503376,Consumer Staples,Beverages (Production/Distribution)
DERM,Journey Medical Corporation Common Stock,80127886,United States,2021,135914,Health Care,Biotechnology: Pharmaceutical Preparations
DESP,Despegar.com Corp. Ordinary Shares,767617200,Argentina,2017,758372,Consumer Discretionary,Transportation Services
DFH,Dream Finders Homes Inc. Class A Common Stock,3389298141,United States,2022,567061,Consumer Discretionary,Homebuilding
DFIN,Donnelley Financial Solutions Inc. Common Stock ,1778868421,United States,2016,114988,Consumer Discretionary,Other Consumer Services
DFLI,Dragonfly Energy Holdings Corp. Common Stock (NV),26797865,United States,2021,4550004,Technology,Electronic Components
DFLIW,Dragonfly Energy Holdings Corp. Warrant,1518546,United States,2021,7458,Technology,Electronic Components
DFP,Flaherty & Crumrine Dynamic Preferred and Income Fund Inc. Common Stock,0,,2013,68729,Finance,Investment Managers
DFS,Discover Financial Services Common Stock,30394862715,United States,,788865,Finance,Finance: Consumer Services
DG,Dollar General Corporation Common Stock,31784242712,United States,2009,2065256,Consumer Discretionary,Department/Specialty Retail Stores
DGHI,Digihost Technology Inc. Common Subordinate Voting Shares,35489480,Canada,,58066,,
DGICA,Donegal Group Inc. Class A Common Stock,444466540,United States,,41145,Finance,Property-Casualty Insurers
DGICB,Donegal Group Inc. Class B Common Stock,434114577,United States,1986,1965,Finance,Property-Casualty Insurers
DGII,Digi International Inc. Common Stock,1102201005,United States,1989,144011,Technology,Computer peripheral equipment
DGLY,Digital Ally Inc. Common Stock,6189662,United States,,7665,Technology,Radio And Television Broadcasting And Communications Equipment
DGX,Quest Diagnostics Incorporated Common Stock,14241386172,United States,,698794,Health Care,Medical Specialities
DH,Definitive Healthcare Corp. Class A Common Stock,834656247,United States,2021,371405,Technology,Computer Software: Prepackaged Software
DHAC,Digital Health Acquisition Corp. Common Stock,43247592,United States,2021,7529,Health Care,Medical/Nursing Services
DHACW,Digital Health Acquisition Corp. Warrant,540955,United States,2021,1,Health Care,Medical/Nursing Services
DHAI,DIH Holdings US Inc. Class A Common Stock,14138777,United States,2024,221259,,
DHAIW,DIH Holding US Inc. Warrants,394571,United States,2024,24520,Finance,Blank Checks
DHC,Diversified Healthcare Trust Common Shares of Beneficial Interest,610662642,United States,,752413,Real Estate,Real Estate Investment Trusts
DHCNI,Diversified Healthcare Trust 5.625% Senior Notes due 2042,3238435350,United States,,8261,Real Estate,Real Estate Investment Trusts
DHCNL,Diversified Healthcare Trust 6.25% Senior Notes Due 2046,3464428611,United States,,14272,Real Estate,Real Estate Investment Trusts
DHF,BNY Mellon High Yield Strategies Fund Common Stock,0,United States,1998,170466,Finance,Finance Companies
DHI,D.R. Horton Inc. Common Stock,49464002228,United States,,2736381,Consumer Discretionary,Homebuilding
DHIL,Diamond Hill Investment Group Inc. Class A Common Stock,424860035,United States,,10832,Finance,Investment Managers
DHR,Danaher Corporation Common Stock,1.77277E+11,United States,,2823997,Industrials,Industrial Machinery/Components
DHT,DHT Holdings Inc.,1817684829,Jersey,2005,812059,Consumer Discretionary,Marine Transportation
DHX,DHI Group Inc. Common Stock,105191147,United States,2007,428063,Consumer Discretionary,Business Services
DHY,Credit Suisse High Yield Bond Fund Common Stock,0,United States,1998,443519,Finance,Finance/Investors Services
DIAX,Nuveen Dow 30SM Dynamic Overwrite Fund Common Shares of Beneficial Interest,0,,2014,103968,Finance,Finance Companies
DIBS,1stdibs.com Inc. Common Stock,194754474,United States,2021,297497,Consumer Discretionary,Catalog/Specialty Distribution
DIN,Dine Brands Global Inc. Common Stock,660910107,United States,,315072,Consumer Discretionary,Restaurants
DINO,HF Sinclair Corporation Common Stock,11705607062,United States,1960,1411345,Energy,Oil & Gas Production
DIOD,Diodes Incorporated Common Stock,3118393896,United States,,336062,Technology,Semiconductors
DIS,Walt Disney Company (The) Common Stock,2.07184E+11,United States,,9629681,Consumer Discretionary,Services-Misc. Amusement & Recreation
DIST,Distoken Acquisition Corporation Ordinary Shares,0,China,2023,7,Finance,Blank Checks
DIT,AMCON Distributing Company Common Stock,110622227,United States,1999,413,Consumer Discretionary,Food Distributors
DJCO,Daily Journal Corp. (S.C.) Common Stock,465434788,United States,,12006,Consumer Discretionary,Newspapers/Magazines
DJT,Trump Media & Technology Group Corp. Common Stock,3637602514,United States,2024,7413478,Technology,Computer Software: Programming Data Processing
DJTWW,Trump Media & Technology Group Corp. Warrants,1588460774,United States,2021,305866,Technology,Computer Software: Programming Data Processing
DK,Delek US Holdings Inc. Common Stock,1981396314,United States,2017,1247235,Energy,Integrated oil Companies
DKL,Delek Logistics Partners L.P. Common Units representing Limited Partner Interests,1630396395,United States,2012,59392,Energy,Oil & Gas Production
DKNG,DraftKings Inc. Class A Common Stock,37889215702,United States,2019,7446029,Consumer Discretionary,Services-Misc. Amusement & Recreation
DKS,Dick's Sporting Goods Inc Common Stock,16368467948,United States,2002,925710,Consumer Discretionary,Other Specialty Stores
DLA,Delta Apparel Inc. Common Stock,18826571,United States,2000,2263,Consumer Staples,Apparel
DLB,Dolby Laboratories Common Stock,7513452062,United States,2005,314200,Technology,EDP Services
DLHC,DLH Holdings Corp.,160807000,United States,,42112,Consumer Discretionary,Professional Services
DLNG,Dynagas LNG Partners LP Common Units,112982898,Greece,,41386,Consumer Discretionary,Marine Transportation
DLNG^A,Dynagas LNG Partners LP 9.00% Series A Cumulative Redeemable Preferred Units,,Greece,,5636,,
DLNG^B,Dynagas LNG Partners LP 8.75% Series B Fixed to Floating Rate Cumulative Redeemable Perpetual Preferred Units liquidation preference $25.00 per Uni,,Greece,,3211,,
DLO,DLocal Limited Class A Common Shares,4561231558,Uruguay,2021,1433351,Consumer Discretionary,Business Services
DLPN,Dolphin Entertainment Inc. Common Stock,23503855,United States,,7000,Consumer Discretionary,Other Consumer Services
DLR,Digital Realty Trust Inc. Common Stock,43271396089,United States,2004,1659021,Real Estate,Real Estate Investment Trusts
DLR^J,Digital Realty Trust Inc. 5.250% Series J Cumulative Redeemable Preferred Stock,,United States,,9160,,
DLR^K,Digital Realty Trust Inc. 5.850% Series K Cumulative Redeemable Preferred Stock par value $0.01 per share,,United States,,18185,,
DLR^L,Digital Realty Trust Inc. 5.200% Series L Cumulative Redeemable Preferred Stock,,United States,,23413,,
DLTH,Duluth Holdings Inc. Class B Common Stock,154508605,United States,2015,76749,Consumer Discretionary,Clothing/Shoe/Accessory Stores
DLTR,Dollar Tree Inc. Common Stock,27326351136,United States,1995,2201931,Consumer Discretionary,Department/Specialty Retail Stores
DLX,Deluxe Corporation Common Stock,837097951,United States,,128071,Consumer Discretionary,Publishing
DLY,DoubleLine Yield Opportunities Fund Common Shares of Beneficial Interest,722542890,United States,2020,208847,Finance,Investment Managers
DM,Desktop Metal Inc. Class A Common Stock,283124801,United States,2019,4562391,Technology,Computer peripheral equipment
DMA,Destra Multi-Alternative Fund Common Stock,0,,2022,30043,Finance,Trusts Except Educational Religious and Charitable
DMAC,DiaMedica Therapeutics Inc. Common Stock,90719620,United States,2018,28638,Health Care,Pharmaceuticals and Biotechnology
DMB,BNY Mellon Municipal Bond Infrastructure Fund Inc. Common Stock,0,,2013,64934,Finance,Trusts Except Educational Religious and Charitable
DMF,BNY Mellon Municipal Income Inc. Common Stock,409873819,United States,1988,44629,Finance,Finance/Investors Services
DMLP,Dorchester Minerals L.P. Common Units Representing Limited Partnership Interests,1326830305,United States,,78118,Energy,Oil & Gas Production
DMO,Western Asset Mortgage Opportunity Fund Inc. Common Stock,0,United States,2010,76643,Finance,Trusts Except Educational Religious and Charitable
DMRC,Digimarc Corporation Common Stock,468567220,United States,,170763,Technology,EDP Services
DMTK,DermTech Inc. Common Stock,21466535,United States,2017,101210,Health Care,Medical Specialities
DMYY,dMY Squared Technology Group Inc. Class A Common Stock,0,,2022,444,Finance,Blank Checks
DNA,Ginkgo Bioworks Holdings Inc. Class A Common Stock,2044775997,United States,2021,44023589,Health Care,Biotechnology: Biological Products (No Diagnostic Substances)
DNB,Dun & Bradstreet Holdings Inc. Common Stock,4120294797,United States,2020,4059985,Finance,Finance: Consumer Services
DNLI,Denali Therapeutics Inc. Common Stock,2482618664,United States,2017,988439,Health Care,Biotechnology: Biological Products (No Diagnostic Substances)
DNMR,Danimer Scientific Inc. Common Stock,89016526,United States,2020,1549955,Industrials,Major Chemicals
DNN,Denison Mines Corp Ordinary Shares (Canada),1835452524,Canada,,24491619,Basic Materials,Other Metals and Minerals
DNOW,DNOW Inc. Common Stock,1590368118,United States,2014,1346161,Industrials,Metal Fabrications
DNP,DNP Select Income Fund Inc. Common Stock,0,United States,1987,742660,Finance,Investment Managers
DNTH,Dianthus Therapeutics Inc. Common Stock,741592625,United States,2018,197131,Health Care,Biotechnology: Pharmaceutical Preparations
DNUT,Krispy Kreme Inc. Common Stock,2414097000,United States,2021,2390506,Consumer Staples,Food Chains
DO,Diamond Offshore Drilling Inc. Common Stock,1409947392,United States,2022,892457,Energy,Oil & Gas Production
DOC,Healthpeak Properties Inc. Common Stock,10007793859,United States,,5117909,Real Estate,Real Estate Investment Trusts
DOCN,DigitalOcean Holdings Inc. Common Stock,3098891200,United States,2021,634283,Technology,Retail: Computer Software & Peripheral Equipment
DOCS,Doximity Inc. Class A Common Stock,4742196325,United States,2021,1808637,Technology,Retail: Computer Software & Peripheral Equipment
DOCU,DocuSign Inc. Common Stock,11640875360,United States,2018,1985391,Technology,Computer Software: Prepackaged Software
DOGZ,Dogness (International) Corporation Class A Common Stock,72334206,China,2017,31155,Consumer Discretionary,Miscellaneous manufacturing industries
DOLE,Dole plc Ordinary Shares,1103077060,Ireland,2021,299224,Consumer Staples,Farming/Seeds/Milling
DOMA,Doma Holdings Inc. Common Stock,84437654,United States,2021,56457,Finance,Real Estate
DOMH,Dominari Holdings Inc. Common Stock,17389307,United States,,20966,Health Care,Biotechnology: Pharmaceutical Preparations
DOMO,Domo Inc. Class B Common Stock,301207183,United States,2018,468215,Technology,Computer Software: Prepackaged Software
DOOO,BRP Inc. (Recreational Products) Common Subordinate Voting Shares,5291177147,Canada,,130815,Consumer Discretionary,Industrial Specialties
DOOR,Masonite International Corporation Ordinary Shares (Canada),2859114443,Canada,,1517233,Basic Materials,Forest Products
DORM,Dorman Products Inc. Common Stock,2790301082,United States,,73936,Consumer Discretionary,Auto Parts:O.E.M.
DOUG,Douglas Elliman Inc. Common Stock,124488160,United States,2021,1178405,Real Estate,Building operators
