Symbol,Name,Market Cap,Country,IPO Year,Volume,Sector,Industry
PTON,Peloton Interactive Inc. Class A Common Stock,1207011361,United States,2019,12860469,Consumer Discretionary,Recreational Games/Products/Toys
PTPI,Petros Pharmaceuticals Inc. Common Stock,5384450,United States,,544049,Health Care,Biotechnology: Pharmaceutical Preparations
PTSI,P.A.M. Transportation Services Inc. Common Stock,323249959,United States,1986,16877,Industrials,Trucking Freight/Courier Services
PTVE,Pactiv Evergreen Inc. Common stock,2558723042,United States,2020,382489,Consumer Discretionary,Containers/Packaging
PTWO,Pono Capital Two Inc. Class A Common Stock,0,United States,2022,13155,Finance,Blank Checks
PTY,Pimco Corporate & Income Opportunity Fund,0,United States,2002,1673137,Finance,Investment Managers
PUBM,PubMatic Inc. Class A Common Stock,1083685365,United States,2020,459817,Technology,Computer Software: Prepackaged Software
PUCK,Goal Acquisitions Corp. Common Stock,0,United States,2021,3,Finance,Blank Checks
PUCKW,Goal Acquisitions Corp. Warrant,0,United States,2021,231,Finance,Blank Checks
PUK,Prudential Public Limited Company Common Stock,24327355879,United Kingdom,,1615200,Finance,Life Insurance
PULM,Pulmatrix Inc. Common Stock,7633276,United States,2014,5269,Health Care,Biotechnology: Pharmaceutical Preparations
PUMP,ProPetro Holding Corp. Common Stock,897109397,United States,2017,2210303,Energy,Oilfield Services/Equipment
PVBC,Provident Bancorp Inc. (MD) Common Stock,139330662,United States,2015,110738,Finance,Banks
PVH,PVH Corp. Common Stock,6134061588,United States,,1065243,Consumer Discretionary,Apparel
PVL,Permianville Royalty Trust Trust Units ,48840000,United States,2011,34542,Energy,Oil & Gas Production
PW,Power REIT (MD) Common Stock,1762624,United States,1998,6149,Real Estate,Real Estate Investment Trusts
PW^A,Power REIT 7.75% Series A Cumulative Perpetual Preferred Stock,,United States,,5,,
PWFL,PowerFleet Inc. Common Stock,456496723,United States,,811900,Telecommunications,Telecommunications Equipment
PWM,Prestige Wealth Inc. Class A Ordinary Shares,9973500,Hong Kong,2023,138345,,
PWOD,Penns Woods Bancorp Inc. Common Stock,130215852,United States,,30037,Finance,Major Banks
PWP,Perella Weinberg Partners Class A Common Stock,1304359961,United States,2020,306706,Finance,Finance: Consumer Services
PWR,Quanta Services Inc. Common Stock,36275462637,United States,,794661,Industrials,Engineering & Construction
PWSC,PowerSchool Holdings Inc. Class A Common Stock,4078204236,United States,2021,896517,Technology,Computer Software: Prepackaged Software
PWUP,PowerUp Acquisition Corp. Class A Ordinary Shares,0,United States,2022,47348,Finance,Blank Checks
PWUPU,PowerUp Acquisition Corp. Unit,0,United States,2022,27,Finance,Blank Checks
PWUPW,PowerUp Acquisition Corp. Warrant,0,United States,2022,50,Finance,Blank Checks
PX,P10 Inc. Class A Common Stock,877189912,United States,2021,623515,Finance,Investment Managers
PXD,Pioneer Natural Resources Company Common Stock,62844619549,United States,,1403046,Energy,Oil & Gas Production
PXDT,Pixie Dust Technologies Inc. American Depositary Shares ,34844373,Japan,2023,7683,,
PXLW,Pixelworks Inc.  Common Stock,99410622,United States,2000,857076,Technology,Semiconductors
PXMD,PaxMedica Inc. Common Stock,5481970,United States,2022,4560900,Health Care, Medicinal Chemicals and Botanical Products 
PXS,Pyxis Tankers Inc. Common Stock,49880000,Greece,,8545,Consumer Discretionary,Marine Transportation
PXSAP,Pyxis Tankers Inc. 7.75% Series A Cumulative Convertible Preferred Shares,313827434,Greece,,137,Consumer Discretionary,Marine Transportation
PXSAW,Pyxis Tankers Inc. Warrant,14930846,Greece,,200,Consumer Discretionary,Marine Transportation
PYCR,Paycor HCM Inc. Common Stock,3103063841,United States,2021,1312113,Technology,Computer Software: Prepackaged Software
PYN,PIMCO New York Municipal Income Fund III Common Shares of Beneficial Interest,0,United States,2002,10226,Finance,Investment Managers
PYPD,PolyPid Ltd. Ordinary Shares,7441016,Israel,2020,3479,Health Care,Medical/Dental Instruments
PYPL,PayPal Holdings Inc. Common Stock,68066325783,United States,,10997462,Consumer Discretionary,Business Services
PYT,PPlus Tr GSC-2 Tr Ctf Fltg Rate,0,United States,,9,Finance,Finance: Consumer Services
PYXS,Pyxis Oncology Inc. Common Stock,275552198,United States,2021,434415,Health Care,Biotechnology: Pharmaceutical Preparations
PZC,PIMCO California Municipal Income Fund III Common Shares of Beneficial Interest,0,United States,2002,47728,Finance,Investment Managers
PZG,Paramount Gold Nevada Corp. Common Stock,27218054,United States,2015,230248,Basic Materials,Metal Mining
PZZA,Papa John's International Inc. Common Stock,2028281819,United States,1993,706748,Consumer Discretionary,Restaurants
QBTS,D-Wave Quantum Inc. Common Shares,255457756,,2022,2755202,Technology,Retail: Computer Software & Peripheral Equipment
QCOM,QUALCOMM Incorporated Common Stock,1.89541E+11,United States,1991,6566429,Technology,Radio And Television Broadcasting And Communications Equipment
QCRH,QCR Holdings Inc. Common Stock,931333125,United States,,42901,Finance,Major Banks
QD,Qudian Inc. American Depositary Shares each representing one Class A Ordinary Share,559713646,China,2017,587505,Finance,Finance: Consumer Services
QDEL,QuidelOrtho Corporation Common Stock,2770911361,United States,,551123,Health Care,Medical Specialities
QDRO,Quadro Acquisition One Corp. Class A Ordinary Shares,0,United States,2021,101,Finance,Blank Checks
QDROW,Quadro Acquisition One Corp.  Warrant,0,United States,2021,200,Finance,Blank Checks
QETA,Quetta Acquisition Corporation Common Stock,0,United States,2023,1331,,
QETAR,Quetta Acquisition Corporation Right,0,United States,2023,3,,
QETAU,Quetta Acquisition Corporation Unit,0,United States,2023,986,,
QFIN,Qifu Technology Inc. American Depositary Shares,2961617187,China,2018,1312296,Finance,Finance: Consumer Services
QGEN,Qiagen N.V. Common Shares,9052803291,Netherlands,,551514,Health Care,Biotechnology: Biological Products (No Diagnostic Substances)
QH,Quhuo Limited American Depository Shares,3638896,China,2020,157977,Consumer Discretionary,Business Services
QIPT,Quipt Home Medical Corp. Common Shares,159147340,United States,,76132,,
QLGN,Qualigen Therapeutics Inc. Common Stock,2017097,United States,2015,36186,Health Care,Biotechnology: Pharmaceutical Preparations
QLI,Qilian International Holding Group Ltd. Ordinary Shares,25025000,China,2021,572791,Health Care,Biotechnology: Pharmaceutical Preparations
QLYS,Qualys Inc. Common Stock,5992164821,United States,2012,478705,Technology,EDP Services
QMCO,Quantum Corporation Common Stock,39650942,United States,,539132,Technology,Electronic Components
QNCX,Quince Therapeutics Inc. Common Stock,43431309,United States,2019,76138,Health Care,Biotechnology: Biological Products (No Diagnostic Substances)
QNRX,Quoin Pharmaceuticals Ltd. American Depositary Shares,2631414,Israel,2016,81502,Health Care,Medical/Dental Instruments
QNST,QuinStreet Inc. Common Stock,939176541,United States,2010,331939,Consumer Discretionary,Advertising
QOMO,Qomolangma Acquisition Corp. Common Stock,0,United States,2022,992,Finance,Blank Checks
QOMOR,Qomolangma Acquisition Corp. Right,0,United States,2022,1607,Finance,Blank Checks
QOMOU,Qomolangma Acquisition Corp. Unit,0,United States,2022,4,Finance,Blank Checks
QOMOW,Qomolangma Acquisition Corp. Warrant,0,United States,2022,600,Finance,Blank Checks
QQQX,Nuveen NASDAQ 100 Dynamic Overwrite Fund Shares of Beneficial Interest,0,United States,,77924,Finance,Finance Companies
QRHC,Quest Resource Holding Corporation Common Stock,184770024,United States,,108138,Utilities,Environmental Services
QRTEA,Qurate Retail Inc. Series A Common Stock ,399583062,United States,,3013620,Consumer Discretionary,Catalog/Specialty Distribution
QRTEB,Qurate Retail Inc. Series B Common Stock ,1547404995,United States,,6410,Consumer Discretionary,Catalog/Specialty Distribution
QRTEP,Qurate Retail Inc. 8.0% Fixed Rate Cumulative Redeemable Preferred Stock,17953815423,United States,,70872,Consumer Discretionary,Catalog/Specialty Distribution
QRVO,Qorvo Inc. Common Stock,10627088772,United States,,1223932,Technology,Semiconductors
QS,QuantumScape Corporation Class A Common Stock,2682328973,United States,2020,10277673,Consumer Discretionary,Auto Parts:O.E.M.
QSG,QuantaSing Group Limited American Depositary Shares,178867932,China,2023,212307,Real Estate,Other Consumer Services
QSI,Quantum-Si Incorporated Class A Common Stock,235338062,United States,2020,789915,Health Care,Biotechnology: Pharmaceutical Preparations
QSIAW,Quantum-Si Incorporated Warrant,34095665,United States,2020,17543,Health Care,Biotechnology: Pharmaceutical Preparations
QSR,Restaurant Brands International Inc. Common Shares,22025350247,Canada,2014,1423507,,
QTI,QT Imaging Holdings Inc. Common Stock,23152193,United States,,192129,Health Care,Biotechnology: Electromedical & Electrotherapeutic Apparatus
QTRX,Quanterix Corporation Common Stock,652791049,United States,2017,664814,Industrials,Biotechnology: Laboratory Analytical Instruments
QTTB,Q32 Bio Inc. Common Stock,85424004,United States,2018,97757,Health Care,Biotechnology: Pharmaceutical Preparations
QTWO,Q2 Holdings Inc. Common Stock,2975568008,United States,2014,423955,Technology,EDP Services
QUAD,Quad Graphics Inc Class A Common Stock,239452169,United States,,291160,Consumer Discretionary,Publishing
QUBT,Quantum Computing Inc. Common Stock,68883661,United States,,1892757,Technology,Computer Manufacturing
QUIK,QuickLogic Corporation Common Stock,183885526,United States,1999,278494,Technology,Semiconductors
QURE,uniQure N.V. Ordinary Shares,226753424,Netherlands,2014,669256,Health Care,Biotechnology: Pharmaceutical Preparations
QVCC,QVC Inc. 6.250% Senior Secured Notes due 2068,12,United States,2019,44093,Consumer Discretionary,Catalog/Specialty Distribution
QVCD,QVC Inc. 6.375% Senior Secured Notes due 2067,12,United States,2018,25433,Consumer Discretionary,Catalog/Specialty Distribution
R,Ryder System Inc. Common Stock,5015360607,United States,,115668,Consumer Discretionary,Rental/Leasing Companies
RA,Brookfield Real Assets Income Fund Inc. Common Stock,0,United States,2016,496427,Finance,Investment Managers
RACE,Ferrari N.V. Common Shares,74139205724,Italy,2015,217465,Consumer Discretionary,Auto Manufacturing
RAIL,FreightCar America Inc. Common Stock,64759573,United States,2005,46166,Industrials,Railroads
RAMP,LiveRamp Holdings Inc. Common Stock,2134425325,United States,2018,706992,Technology,EDP Services
RAND,Rand Capital Corporation Common Stock,36082674,United States,,564,Finance,Finance: Consumer Services
RANI,Rani Therapeutics Holdings Inc. Class A Common Stock,288906002,United States,2021,219678,Health Care, Medicinal Chemicals and Botanical Products 
RAPT,RAPT Therapeutics Inc. Common Stock,297172375,United States,2019,1112616,Health Care,Biotechnology: Pharmaceutical Preparations
RARE,Ultragenyx Pharmaceutical Inc. Common Stock,3529730902,United States,2014,1727284,Health Care,Biotechnology: Pharmaceutical Preparations
RAVE,Rave Restaurant Group Inc. Common Stock,30048326,United States,,23132,Consumer Discretionary,Restaurants
RAYA,Erayak Power Solution Group Inc. Class A Ordinary Shares,7884585,China,2022,44786,Consumer Discretionary,Metal Fabrications
RBA,RB Global Inc. Common Stock,13374865552,Canada,,1007010,Consumer Discretionary,Business Services
RBB,RBB Bancorp Common Stock,315080535,United States,2017,17655,Finance,Major Banks
RBBN,Ribbon Communications Inc. Common Stock,460472806,United States,,303053,Technology,EDP Services
RBC,RBC Bearings Incorporated Common Stock,7347132250,United States,2022,113769,Industrials,Metal Fabrications
RBCAA,Republic Bancorp Inc. Class A Common Stock,927456134,United States,1998,7220,Finance,Major Banks
RBCP,RBC Bearings Incorporated 5.00% Series A Mandatory Convertible Preferred Stock,3371679152,United States,2022,51878,Industrials,Metal Fabrications
RBKB,Rhinebeck Bancorp Inc. Common Stock,85701978,United States,2019,321,Finance,Banks
RBLX,Roblox Corporation Class A Common Stock,23155857329,United States,2021,7048843,Technology,EDP Services
RBOT,Vicarious Surgical Inc. Class A Common Stock,51618266,Hong Kong,2020,501133,Health Care,Medical Specialities
RBT,Rubicon Technologies Inc. Class A Common Stock,18031277,,2022,158770,Technology,Semiconductors
RC,Ready Capital Corproation Common Stock,1447732456,United States,2013,1948919,Real Estate,Real Estate Investment Trusts
RC^C,Ready Capital Corporation 6.25% Series C Cumulative Convertible Preferred Stock,,United States,,138,,
RC^E,Ready Capital Corporation 6.50% Series E Cumulative Redeemable Preferred Stock,,United States,,25277,,
RCAT,Red Cat Holdings Inc. Common Stock,70567444,United States,,1721238,Industrials,Wholesale Distributors
RCB,Ready Capital Corporation 6.20% Senior Notes due 2026,4139583031,United States,2019,8510,Real Estate,Real Estate Investment Trusts
RCC,Ready Capital Corporation 5.75% Senior Notes due 2026,4187898297,United States,2021,16129,Real Estate,Real Estate Investment Trusts
RCEL,Avita Medical Inc. Common Stock,243185023,United States,,547137,Health Care,Medical/Dental Instruments
RCFA,RCF Acquisition Corp. Class A Ordinary Shares,0,,2021,535,Finance,Blank Checks
RCG,RENN Fund Inc Common Stock,0,United States,,17702,Finance,Investment Managers
RCI,Rogers Communication Inc. Common Stock,20140239811,Canada,,1068433,,
RCKT,Rocket Pharmaceuticals Inc. Common Stock,2173006994,United States,2015,584047,Health Care,Biotechnology: Pharmaceutical Preparations
RCKTW,Rocket Pharmaceuticals Inc. Warrant,,United States,,107653,Health Care,Biotechnology: Pharmaceutical Preparations
RCKY,Rocky Brands Inc. Common Stock,189666651,United States,1993,19361,Consumer Discretionary,Shoe Manufacturing
RCL,Royal Caribbean Cruises Ltd. Common Stock,32638199194,United States,1993,3351973,Consumer Discretionary,Marine Transportation
RCM,R1 RCM Inc. Common Stock,5182055285,United States,,2223529,Consumer Discretionary,Other Consumer Services
RCMT,RCM Technologies Inc. Common Stock,151325326,United States,,54973,Consumer Discretionary,Professional Services
RCON,Recon Technology Ltd. Class A Ordinary Shares,5511838,China,2009,5478939,Energy,Oilfield Services/Equipment
RCRT,Recruiter.com Group Inc. Common Stock,2423296,United States,,6874,Technology,EDP Services
RCRTW,Recruiter.com Group Inc. Warrant,7886,United States,,651,Technology,EDP Services
RCS,PIMCO Strategic Income Fund Inc.,0,United States,1994,167831,Finance,Investment Managers
RCUS,Arcus Biosciences Inc. Common Stock,1480188064,United States,2018,433335,Health Care,Biotechnology: Pharmaceutical Preparations
RDCM,Radcom Ltd. Ordinary Shares,145270377,Israel,1997,46983,Technology,Computer peripheral equipment
RDDT,Reddit Inc. Class A Common Stock,6359723600,,2024,3444172,,
RDFN,Redfin Corporation Common Stock,684446359,United States,2017,6117233,Finance,Real Estate
RDHL,Redhill Biopharma Ltd. American Depositary Shares,12880639,Israel,,320693,Health Care,Biotechnology: Pharmaceutical Preparations
RDI,Reading International Inc Class A Common Stock,40850708,United States,,9664,Consumer Discretionary,Movies/Entertainment
RDIB,Reading International Inc Class B Common Stock,330865470,United States,,487,Consumer Discretionary,Movies/Entertainment
RDN,Radian Group Inc. Common Stock,4514643320,United States,,901977,Finance,Property-Casualty Insurers
RDNT,RadNet Inc. Common Stock,3273810930,United States,,414345,Health Care,Medical Specialities
RDUS,Radius Recycling Inc. Class A Common Stock,492486034,United States,,348360,Consumer Discretionary,Industrial Specialties
RDVT,Red Violet Inc. Common Stock ,253307468,United States,,25375,Technology,Computer Software: Prepackaged Software
RDW,Redwire Corporation Common Stock,233460257,United States,2021,196836,Industrials,Military/Government/Technical
RDWR,Radware Ltd. Ordinary Shares,685946510,Israel,1999,483688,Consumer Discretionary,Business Services
RDY,Dr. Reddy's Laboratories Ltd Common Stock,11843462541,India,,369619,Health Care,Biotechnology: Pharmaceutical Preparations
RDZN,Roadzen Inc. Ordinary Shares,376424560,United States,2022,26326,Finance,Blank Checks
RDZNW,Roadzen Inc. Warrants,6850927,United States,2022,200,Finance,Blank Checks
REAL,The RealReal Inc. Common Stock,325593398,United States,2019,1939349,Consumer Discretionary,Other Specialty Stores
REAX,The Real Brokerage Inc. Common Shares,684849563,Canada,,909493,,
REBN,Reborn Coffee Inc. Common Stock,2852192,United States,2022,18679,Consumer Discretionary,Restaurants
REE,REE Automotive Ltd. Class A Ordinary Shares,41224486,Israel,,61107,Consumer Discretionary,Auto Manufacturing
REFI,Chicago Atlantic Real Estate Finance Inc. Common Stock,279690841,United States,2021,123215,Real Estate,Real Estate Investment Trusts
REFR,Research Frontiers Incorporated Common Stock,48923559,United States,,89530,Miscellaneous,Multi-Sector Companies
REG,Regency Centers Corporation Common Stock,10690789848,United States,1993,1623138,Real Estate,Real Estate Investment Trusts
REGCO,Regency Centers Corporation 5.875% Series B Cumulative Redeemable Preferred Stock,4060728188,United States,,7863,,
REGCP,Regency Centers Corporation 6.25% Series A Cumulative Redeemable Preferred Stock,4237923600,United States,,2987,,
REGN,Regeneron Pharmaceuticals Inc. Common Stock,98627649270,United States,1991,656248,Health Care,Biotechnology: Pharmaceutical Preparations
REI,Ring Energy Inc. Common Stock,407744456,United States,,1484246,Energy,Oil & Gas Production
REKR,Rekor Systems Inc. Common Stock,165530341,United States,,1023796,Telecommunications,Telecommunications Equipment
RELI,Reliance Global Group Inc. Common Stock,1582484,United States,,442237,Finance,Specialty Insurers
RELL,Richardson Electronics Ltd. Common Stock,141356566,United States,1983,211335,Technology,Electronic Components
RELX,RELX PLC PLC American Depositary Shares (Each representing One Ordinary Share),78409087714,United Kingdom,2015,2127565,Consumer Discretionary,Business Services
RELY,Remitly Global Inc. Common Stock,3491115804,United States,2021,1703540,Technology,Computer Software: Prepackaged Software
RENB,Renovaro Inc. Common Stock,351987511,United States,,424128,Health Care,Biotechnology: Pharmaceutical Preparations
RENE,Cartesian Growth Corporation II Class A Ordinary Shares,0,United States,2022,8158,Finance,Blank Checks
RENEW,Cartesian Growth Corporation II Warrant,0,United States,2022,201,Finance,Blank Checks
RENT,Rent the Runway Inc. Class A Common Stock,54055402,United States,2021,3600781,Consumer Discretionary,Other Specialty Stores
REPL,Replimune Group Inc. Common Stock,437081036,United States,2018,671857,Health Care,Biotechnology: Biological Products (No Diagnostic Substances)
REPX,Riley Exploration Permian Inc. Common Stock,584868917,United States,1999,199220,Energy,Oil & Gas Production
RERE,ATRenew Inc. American Depositary Shares (every three of which representing two Class A ordinary shares),382739361,Cayman Islands,2021,345775,Consumer Discretionary,Other Specialty Stores
RES,RPC Inc. Common Stock,1682628558,United States,,1401213,Energy,Oilfield Services/Equipment
RETO,ReTo Eco-Solutions Inc. Common Shares,4456775,China,2017,98891,Consumer Discretionary,Multi-Sector Companies
REVB,Revelation Biosciences Inc. Common Stock,2980106,United States,2020,94005,Health Care,Biotechnology: Pharmaceutical Preparations
REVBW,Revelation Biosciences Inc. Warrant,32332,United States,2020,26124,Health Care,Biotechnology: Pharmaceutical Preparations
REVG,REV Group Inc. Common Stock,1144785194,United States,2017,681445,Consumer Discretionary,Auto Manufacturing
REX,REX American Resources Corporation,957629889,United States,,141711,Industrials,Major Chemicals
REXR,Rexford Industrial Realty Inc. Common Stock,9693940127,United States,2013,2890632,Real Estate,Real Estate Investment Trusts
REXR^B,Rexford Industrial Realty Inc. 5.875% Series B Cumulative Redeemable Preferred Stock,,United States,,12564,,
REXR^C,Rexford Industrial Realty Inc. 5.625% Series C Cumulative Redeemable Preferred Stock par value $0.01 per share,,United States,,3076,,
REYN,Reynolds Consumer Products Inc. Common Stock,5873964624,United States,2020,615150,Consumer Discretionary,Containers/Packaging
REZI,Resideo Technologies Inc. Common Stock ,2955784026,United States,2018,1150516,Industrials,Wholesale Distributors
RF,Regions Financial Corporation Common Stock,17660567003,United States,,6936603,Finance,Major Banks
RF^B,Regions Financial Corporation Depositary Shares Representing 1/40th Perpetual Preferred Series B,,United States,,71929,,
RF^C,Regions Financial Corporation Depositary Shares each Representing a 1/40th Interest in a  Share of 5.700% Fixed-to-Floating Rate Non-Cumulative  Perpetual Preferred Stock Series C,,United States,,38415,,
RF^E,Regions Financial Corporation Depositary Shares Each Representing a 1/40th Interest in a Share of 4.45% Non-Cumulative Perpetual Preferred Stock Series E,,United States,,39556,,
RFAC,RF Acquisition Corp. Class A Common Stock,0,Singapore,2022,5007,Finance,Blank Checks
RFACR,RF Acquisition Corp. Rights,0,Singapore,2022,1897,Finance,Blank Checks
RFACW,RF Acquisition Corp. Warrants,0,Singapore,2022,7100,Finance,Blank Checks
RFI,Cohen & Steers Total Return Realty Fund Inc. Common Stock,530697182,United States,1993,64910,Finance,Investment Managers
RFIL,RF Industries Ltd. Common Stock,32326288,United States,,2284,Technology,Electrical Products
RFL,Rafael Holdings Inc. Class B Common Stock,44743679,United States,2018,72357,Health Care,Biotechnology: Pharmaceutical Preparations
RFM,RiverNorth Flexible Municipal Income Fund Inc. Common Stock,96734538,,2020,27123,Finance,Finance/Investors Services
RFMZ,RiverNorth Flexible Municipal Income Fund II Inc. Common Stock,329722776,,2021,83719,Finance,Trusts Except Educational Religious and Charitable
RGA,Reinsurance Group of America Incorporated Common Stock,11944114376,United States,,486614,Finance,Life Insurance
RGC,Regencell Bioscience Holdings Limited Ordinary Shares,48277733,Hong Kong,2021,2857,Health Care, Medicinal Chemicals and Botanical Products 
RGCO,RGC Resources Inc. Common Stock,200727051,United States,,22559,Utilities,Oil & Gas Production
RGEN,Repligen Corporation Common Stock,9279749169,United States,1986,447313,Health Care,Medical/Dental Instruments
RGF,The Real Good Food Company Inc. Class A Common Stock,12126313,United States,2021,398704,Consumer Staples,Packaged Foods
RGLD,Royal Gold Inc. Common Stock,7949438776,United States,,601149,Industrials,Precious Metals
RGLS,Regulus Therapeutics Inc. Common Stock,181993398,United States,2012,315039,Health Care,Biotechnology: Pharmaceutical Preparations
RGNX,REGENXBIO Inc. Common Stock,800584541,United States,2015,346015,Health Care,Biotechnology: Biological Products (No Diagnostic Substances)
RGP,Resources Connection Inc. Common Stock,383038510,United States,,329572,Consumer Discretionary,Business Services
RGR,Sturm Ruger & Company Inc. Common Stock,803544458,United States,,166760,Industrials,Ordnance And Accessories
RGS,Regis Corporation Common Stock,13699495,United States,1991,35177,Consumer Discretionary,Other Consumer Services
RGT,Royce Global Value Trust Inc. Common Stock,63922819,,2013,11283,Finance,Trusts Except Educational Religious and Charitable
RGTI,Rigetti Computing Inc. Common Stock,171591504,United States,,4815119,Technology,Retail: Computer Software & Peripheral Equipment
RGTIW,Rigetti Computing Inc. Warrants,31776204,United States,,20016,Technology,Retail: Computer Software & Peripheral Equipment
RH,RH Common Stock,4606742982,United States,2012,685686,Consumer Discretionary,Other Specialty Stores
RHE,Regional Health Properties Inc. Common Stock,4988731,,2017,6777,Real Estate,Real Estate
RHE^A,Regional Health Properties Inc. 10.875% Series A Cumulative Redeemable Preferred Stock,,,,170,,
RHI,Robert Half Inc. Common Stock,7423513101,United States,,851184,Consumer Discretionary,Professional Services
RHP,Ryman Hospitality Properties Inc. (REIT),6534844508,United States,,383320,Real Estate,Real Estate Investment Trusts
RICK,RCI Hospitality Holdings Inc. Common Stock,470230574,United States,1995,49195,Consumer Discretionary,Restaurants
RIG,Transocean Ltd (Switzerland) Common Stock,4894636618,Switzerland,,13367207,Energy,Oil & Gas Production
RIGL,Rigel Pharmaceuticals Inc. Common Stock,201684484,United States,2000,768549,Health Care,Biotechnology: Pharmaceutical Preparations
RILY,B. Riley Financial Inc. Common Stock,621443939,United States,,627729,Finance,Investment Managers
RILYG,B. Riley Financial Inc. 5.00% Senior Notes due 2026,511957261,United States,,14359,Finance,Investment Managers
RILYK,B. Riley Financial Inc. 5.50% Senior Notes Due 2026,588108609,United States,,14749,Finance,Investment Managers
RILYL,B. Riley Financial Inc. Depositary Shares each representing 1/1000th in a share of 7.375% Series B Cumulative Perpetual Preferred Stock par value $0.0001,587191123,United States,,2760,Finance,Investment Managers
RILYM,B. Riley Financial Inc. 6.375% Senior Notes due 2025,710189314,United States,,32037,Finance,Investment Managers
RILYN,B. Riley Financial Inc. 6.50% Senior Notes Due 2026,559972368,United States,,23746,Finance,Investment Managers
RILYO,B. Riley Financial Inc. 6.75% Senior Notes due 2024,761519604,United States,,6547,Finance,Investment Managers
RILYP,B. Riley Financial Inc. Depositary Shares each representing a 1/1000th fractional interest in a share of Series A Cumulative Perpetual Preferred Stock,491160908,United States,,17483,Finance,Investment Managers
RILYT,B. Riley Financial Inc. 6.00% Senior Notes Due 2028,472811186,United States,,20431,Finance,Investment Managers
