Symbol,Name,Market Cap,Country,IPO Year,Volume,Sector,Industry
A,Agilent Technologies Inc. Common Stock,41092211922,United States,1999,1506028,Industrials,Electrical Products
AA,Alcoa Corporation Common Stock ,6566472264,United States,2016,9910706,Industrials,Aluminum
AACG,ATA Creativity Global American Depositary Shares,27520112,China,2008,19111,Real Estate,Other Consumer Services
AACI,Armada Acquisition Corp. I Common Stock,0,United States,2021,1442,Finance,Blank Checks
AACIW,Armada Acquisition Corp. I Warrant,0,United States,2021,9704,Finance,Blank Checks
AACT,Ares Acquisition Corporation II Class A Ordinary Shares,0,,2023,24185,Finance,Blank Checks
AADI,Aadi Bioscience Inc. Common Stock,46652990,United States,,166038,Health Care,Biotechnology: Pharmaceutical Preparations
AAGR,African Agriculture Holdings Inc. Common Stock,10500219,United States,2021,113123,Finance,Finance: Consumer Services
AAGRW,African Agriculture Holdings Inc. Warrant,374828,United States,2021,7998,Finance,Finance: Consumer Services
AAL,American Airlines Group Inc. Common Stock,8472553199,United States,,27420853,Consumer Discretionary,Air Freight/Delivery Services
AAMC,Altisource Asset Management Corp Com,9260106,United States,,3607,Finance,Real Estate
AAME,Atlantic American Corporation Common Stock,41212622,United States,,9476,Finance,Life Insurance
AAN,Aarons Holdings Company Inc. Common Stock ,215262567,United States,2020,205610,Miscellaneous,Diversified Commercial Services
AAOI,Applied Optoelectronics Inc. Common Stock,428522629,United States,2013,1301625,Technology,Semiconductors
AAON,AAON Inc. Common Stock,7109027508,United States,,470476,Industrials,Industrial Machinery/Components
AAP,Advance Auto Parts Inc.,4173337023,United States,,1402544,Consumer Discretionary,Auto & Home Supply Stores
AAPL,Apple Inc. Common Stock,2.66666E+12,United States,1980,73454318,Technology,Computer Manufacturing
AAT,American Assets Trust Inc. Common Stock,1250190487,United States,2011,202173,Real Estate,Real Estate Investment Trusts
AB,AllianceBernstein Holding L.P.  Units,3712492875,United States,,315469,Finance,Investment Managers
ABAT,American Battery Technology Company Common Stock,83534739,United States,,626150,Basic Materials,Metal Mining
ABBV,AbbVie Inc. Common Stock,2.85586E+11,United States,2012,5433608,Health Care,Biotechnology: Pharmaceutical Preparations
ABCB,Ameris Bancorp Common Stock,3109809023,United States,1994,251889,Finance,Major Banks
ABCL,AbCellera Biologics Inc. Common Shares,1209507524,Canada,2020,1358936,Health Care,Biotechnology: Pharmaceutical Preparations
ABEO,Abeona Therapeutics Inc. Common Stock,208992483,United States,,113658,Health Care,Biotechnology: Pharmaceutical Preparations
ABEV,Ambev S.A. American Depositary Shares (Each representing 1 Common Share),36548893219,Brazil,2013,15960838,Consumer Staples,Beverages (Production/Distribution)
ABG,Asbury Automotive Group Inc Common Stock,4389334510,United States,2002,182151,Consumer Discretionary,Retail-Auto Dealers and Gas Stations
ABIO,ARCA biopharma Inc. Common Stock,46113635,United States,,134500,Health Care,Biotechnology: In Vitro & In Vivo Diagnostic Substances
ABL,Abacus Life Inc. Class A Common Stock,757967620,United States,2020,13600,Finance,Investment Managers
ABLLL,Abacus Life Inc. 9.875% Fixed Rate Senior Notes due 2028,1621031591,United States,,220,,
ABLLW,Abacus Life Inc. Warrant,31210431,United States,2020,38537,Finance,Investment Managers
ABLV,Able View Global Inc. Class B Ordinary Shares,79635358,China,,93391,,
ABM,ABM Industries Incorporated Common Stock,2813939379,United States,,689863,Finance,Diversified Commercial Services
ABNB,Airbnb Inc. Class A Common Stock,1.00683E+11,United States,2020,3722052,Consumer Discretionary,Hotels/Resorts
ABOS,Acumen Pharmaceuticals Inc. Common Stock,212081616,United States,2021,214986,Health Care,Biotechnology: Pharmaceutical Preparations
ABR,Arbor Realty Trust Common Stock,2295994116,United States,2004,3705241,Real Estate,Real Estate Investment Trusts
ABR^D,Arbor Realty Trust 6.375% Series D Cumulative Redeemable Preferred Stock Liquidation Preference $25.00 per Share,,United States,,33895,,
ABR^E,Arbor Realty Trust 6.25% Series E Cumulative Redeemable Preferred Stock,,United States,,7766,,
ABR^F,Arbor Realty Trust 6.25% Series F Fixed-to-Floating Rate Cumulative Redeemable Preferred Stock Liquidation Preference $25.00 per share,,United States,,26888,,
ABSI,Absci Corporation Common Stock,612420248,United States,2021,1417213,Health Care,Biotechnology: Pharmaceutical Preparations
ABT,Abbott Laboratories Common Stock,1.88944E+11,United States,,4595092,Health Care,Medical/Dental Instruments
ABTS,Abits Group Inc Ordinary Shares,15279808,China,,478007,Technology,Computer Software: Programming Data Processing
ABUS,Arbutus Biopharma Corporation Common Stock,533091831,Canada,,3625999,Health Care,Biotechnology: Pharmaceutical Preparations
ABVC,ABVC BioPharma Inc. Common Stock,11510859,United States,,218105,Health Care,Biotechnology: Pharmaceutical Preparations
ABVX,Abivax SA American Depositary Shares,925220308,France,2023,41744,,
AC,Associated Capital Group Inc. Common Stock,692510131,United States,2015,1287,Finance,Investment Bankers/Brokers/Service
ACA,Arcosa Inc. Common Stock ,3899065381,United States,2018,118301,Industrials,Metal Fabrications
ACAB,Atlantic Coastal Acquisition Corp. II Class A Common Stock,0,United States,2022,5208,Finance,Blank Checks
ACAC,Acri Capital Acquisition Corporation Class A Common Stock,0,United States,2022,2332,Finance,Blank Checks
ACACU,Acri Capital Acquisition Corporation Unit,0,United States,2022,100,Finance,Blank Checks
ACACW,Acri Capital Acquisition Corporation Warrant,0,United States,2022,2593,Finance,Blank Checks
ACAD,ACADIA Pharmaceuticals Inc. Common Stock,2782990990,United States,1985,1112106,Health Care,Biotechnology: Pharmaceutical Preparations
ACB,Aurora Cannabis Inc. Common Shares,342507281,Canada,,6933370,Health Care,Pharmaceuticals and Biotechnology
ACBA,Ace Global Business Acquisition Limited Ordinary Shares,46042996,Hong Kong,2021,626,Consumer Discretionary,Catalog/Specialty Distribution
ACBAW,Ace Global Business Acquisition Limited Warrant,0,Hong Kong,2021,25598,Consumer Discretionary,Business Services
ACCD,Accolade Inc. Common Stock,664157268,United States,2020,813882,Consumer Discretionary,Business Services
ACCO,Acco Brands Corporation Common Stock,476540166,United States,,519908,Consumer Discretionary,Publishing
ACDC,ProFrac Holding Corp. Class A Common Stock,1354954690,United States,2022,1032870,Energy,Oilfield Services/Equipment
ACEL,Accel Entertainment Inc. ,914296120,United States,2017,192049,Consumer Discretionary,Services-Misc. Amusement & Recreation
ACET,Adicet Bio Inc. Common Stock ,180738765,United States,2018,495244,Health Care,Biotechnology: Pharmaceutical Preparations
ACGL,Arch Capital Group Ltd. Common Stock,33583813058,Bermuda,,1762607,Finance,Property-Casualty Insurers
ACGLN,Arch Capital Group Ltd. Depositary Shares each Representing a 1/1000th Interest in a 4.550% Non-Cumulative Preferred Share Series G,7221118450,Bermuda,,43925,Finance,Property-Casualty Insurers
ACGLO,Arch Capital Group Ltd. Depositary Shares Each Representing 1/1000th Interest in a Share of 5.45% Non-Cumulative Preferred Shares Series F,8399694777,Bermuda,,54044,Finance,Property-Casualty Insurers
ACHC,Acadia Healthcare Company Inc. Common Stock,6747253761,United States,,831050,Health Care,Medical Specialities
ACHL,Achilles Therapeutics plc American Depositary Shares,33794833,United Kingdom,2021,250943,Health Care,Biotechnology: Biological Products (No Diagnostic Substances)
ACHR,Archer Aviation Inc. Class A Common Stock,1208135918,United States,2020,3878598,Industrials,Aerospace
ACHV,Achieve Life Sciences Inc. Common Shares,152421004,United States,,114653,Health Care,Biotechnology: In Vitro & In Vivo Diagnostic Substances
ACI,Albertsons Companies Inc. Class A Common Stock,11659046888,United States,2020,2911539,Consumer Staples,Food Chains
ACIC,American Coastal Insurance Corporation Common Stock,512888259,United States,,155288,Finance,Property-Casualty Insurers
ACIU,AC Immune SA Common Stock,249978529,Switzerland,2016,113090,Health Care,Biotechnology: Pharmaceutical Preparations
ACIW,ACI Worldwide Inc. Common Stock,3352000554,United States,,376130,Technology,EDP Services
ACLS,Axcelis Technologies Inc. Common Stock,3403845541,United States,2000,410299,Technology,Industrial Machinery/Components
ACLX,Arcellx Inc. Common Stock,3007295361,United States,2022,381994,Health Care,Biotechnology: Pharmaceutical Preparations
ACM,AECOM Common Stock,12744041809,United States,2007,1154022,Consumer Discretionary,Military/Government/Technical
ACMR,ACM Research Inc. Class A Common Stock,1723490401,United States,2017,1298381,Technology,Industrial Machinery/Components
ACN,Accenture plc Class A Ordinary Shares (Ireland),1.97061E+11,Ireland,2001,2997869,Consumer Discretionary,Business Services
ACNB,ACNB Corporation Common Stock,277528298,United States,,5106,Finance,Major Banks
ACNT,Ascent Industries Co. Common Stock,104285244,United States,,4480,Industrials,Steel/Iron Ore
ACON,Aclarion Inc. Common Stock,168221,United States,2022,183280,Technology,Retail: Computer Software & Peripheral Equipment
ACONW,Aclarion Inc. Warrant,14234,United States,2022,76,Technology,Retail: Computer Software & Peripheral Equipment
ACP,abrdn Income Credit Strategies Fund Common Shares,0,United States,2011,523896,Finance,Investment Managers
ACP^A,abrdn Income Credit Strategies Fund 5.250% Series A Perpetual Preferred Stock,,United States,,2852,,
ACR,ACRES Commercial Realty Corp. Common Stock,103828466,United States,,19660,Real Estate,Real Estate Investment Trusts
ACR^C,ACRES Commercial Realty Corp. 8.625% Fixed-to-Floating Series C Cumulative Redeemable Preferred Stock ,,United States,,20325,,
ACR^D,ACRES Commercial Realty Corp. 7.875% Series D Cumulative Redeemable Preferred Stock,,United States,,9901,,
ACRE,Ares Commercial Real Estate Corporation Common Stock,366808412,United States,2012,844542,Real Estate,Real Estate Investment Trusts
ACRS,Aclaris Therapeutics Inc. Common Stock,85819301,United States,2015,1069344,Health Care,Biotechnology: Pharmaceutical Preparations
ACRV,Acrivon Therapeutics Inc. Common Stock,296679449,United States,2022,394270,Health Care, Medicinal Chemicals and Botanical Products 
ACST,Acasti Pharma Inc. Class A Common Stock,31581997,Canada,,21644,Health Care,Biotechnology: Pharmaceutical Preparations
ACT,Enact Holdings Inc. Common Stock,4682570777,United States,2021,136046,Finance,Specialty Insurers
ACTG,Acacia Research Corporation (Acacia Tech) Common Stock,494482591,United States,,252988,Miscellaneous,Multi-Sector Companies
ACU,Acme United Corporation. Common Stock,159076528,United States,1988,37026,Consumer Discretionary,Industrial Machinery/Components
ACV,Virtus Diversified Income & Convertible Fund Common Shares of Beneficial Interest,230886615,United States,2015,20684,Finance,Finance/Investors Services
ACVA,ACV Auctions Inc. Class A Common Stock,2779600739,United States,2021,632897,Consumer Discretionary,Business Services
ACXP,Acurx Pharmaceuticals Inc. Common Stock,25762862,United States,2021,93843,Health Care,Biotechnology: Pharmaceutical Preparations
ADAG,Adagene Inc. American Depositary Shares,143379181,China,2021,8465,Health Care,Biotechnology: Pharmaceutical Preparations
ADAP,Adaptimmune Therapeutics plc American Depositary Shares,259166330,United Kingdom,2015,1323992,Health Care,Biotechnology: Biological Products (No Diagnostic Substances)
ADBE,Adobe Inc. Common Stock,2.10605E+11,United States,1986,3352000,Technology,Computer Software: Prepackaged Software
ADC,Agree Realty Corporation Common Stock,5597922880,United States,,690532,Real Estate,Real Estate Investment Trusts
ADC^A,Agree Realty Corporation Depositary Shares each representing 1/1000th of a 4.250% Series A Cumulative Redeemable Preferred Stock,,United States,,14505,,
ADCT,ADC Therapeutics SA Common Shares,360654129,,2020,464478,Health Care,Biotechnology: Pharmaceutical Preparations
ADD,Color Star Technology Co. Ltd. Class A Ordinary Shares,3801650,United States,,184811,Consumer Discretionary,Engineering & Construction
ADEA,Adeia Inc. Common Stock,1094659670,United States,2003,469222,Technology,Semiconductors
ADI,Analog Devices Inc. Common Stock,94366361864,United States,,2560475,Technology,Semiconductors
ADIL,Adial Pharmaceuticals Inc Common Stock,10583187,United States,2018,3278798,Health Care,Biotechnology: Pharmaceutical Preparations
ADM,Archer-Daniels-Midland Company Common Stock,30856070740,United States,,3153332,Consumer Staples,Packaged Foods
ADMA,ADMA Biologics Inc Common Stock,1364757011,United States,,1814443,Health Care,Biotechnology: Biological Products (No Diagnostic Substances)
ADN,Advent Technologies Holdings Inc. Class A Common Stock,10192591,United States,2018,335663,Miscellaneous,Industrial Machinery/Components
ADNT,Adient plc Ordinary Shares ,2663466624,United States,2016,961227,Consumer Discretionary,Auto Parts:O.E.M.
ADNWW,Advent Technologies Holdings Inc. Warrant,969234,United States,2018,8653,Miscellaneous,Industrial Machinery/Components
ADP,Automatic Data Processing Inc. Common Stock,1.00266E+11,United States,,1383647,Technology,EDP Services
ADPT,Adaptive Biotechnologies Corporation Common Stock,422218509,United States,2019,3152255,Health Care,Biotechnology: Biological Products (No Diagnostic Substances)
ADRT,Ault Disruptive Technologies Corporation Common Stock,188456250,,2022,861,Finance,Blank Checks
ADSE,ADS-TEC ENERGY PLC Ordinary Shares,510307200,Ireland,,25394,Consumer Discretionary,Industrial Specialties
ADSEW,ADS-TEC ENERGY PLC Warrant,105574670,Ireland,,292,Consumer Discretionary,Industrial Specialties
ADSK,Autodesk Inc. Common Stock,49119236927,United States,,1385662,Technology,Computer Software: Prepackaged Software
ADT,ADT Inc. Common Stock,5746020924,United States,2018,2672771,Consumer Discretionary,Diversified Commercial Services
ADTH,AdTheorent Holding Company Inc. Common Stock,291802829,United States,2021,2499486,Consumer Discretionary,Advertising
ADTHW,AdTheorent Holding Company Inc. Warrants,36543532,United States,2021,7881,Consumer Discretionary,Advertising
ADTN,ADTRAN Holdings Inc. Common Stock,370261907,United States,1994,1095550,Telecommunications,Telecommunications Equipment
ADTX,Aditxt Inc. Common Stock,4446121,United States,2020,84278,Health Care,Biotechnology: Pharmaceutical Preparations
ADUS,Addus HomeCare Corporation Common Stock,1569661989,United States,2009,114766,Health Care,Medical/Nursing Services
ADV,Advantage Solutions Inc. Class A Common Stock,1320158923,United States,2019,1534236,Consumer Discretionary,Advertising
ADVM,Adverum Biotechnologies Inc. Common Stock,239304170,United States,2014,99363,Health Care,Biotechnology: Biological Products (No Diagnostic Substances)
ADVWW,Advantage Solutions Inc. Warrant,38451231,United States,2019,1300,Consumer Discretionary,Advertising
ADX,Adams Diversified Equity Fund Inc.,0,United States,,228362,Finance,Investment Managers
ADXN,Addex Therapeutics Ltd American Depositary Shares,19650683,Switzerland,,18321,Health Care,Biotechnology: Pharmaceutical Preparations
AE,Adams Resources & Energy Inc. Common Stock,74458487,United States,1980,2521,Energy,Oil Refining/Marketing
AEAE,AltEnergy Acquisition Corp. Class A Common Stock,0,United States,2021,395,Finance,Blank Checks
AEAEW,AltEnergy Acquisition Corp. Warrant,0,United States,2021,1700,Finance,Blank Checks
AEE,Ameren Corporation Common Stock,19060957100,United States,,1214164,Utilities,Power Generation
AEF,abrdn Emerging Markets Equity Income Fund Inc. Common Stock,532518000,United States,,87857,Finance,Finance/Investors Services
AEFC,Aegon Funding Company LLC 5.10% Subordinated Notes due 2049,0,United States,2019,82453,,
AEG,Aegon Ltd. New York Registry Shares,13028513158,Netherlands,,3965052,Finance,Life Insurance
AEHL,Antelope Enterprise Holdings Limited Class A Ordinary Shares,2860410,China,,100027,Consumer Discretionary,Building Products
AEHR,Aehr Test Systems Common Stock,333965120,United States,1997,1191886,Industrials,Electrical Products
AEI,Alset Inc. Common Stock (TX),5840289,United States,2020,16409,Real Estate,Building operators
AEIS,Advanced Energy Industries Inc. Common Stock,3540257280,United States,1995,117751,Technology,Industrial Machinery/Components
AEL,American Equity Investment Life Holding Company Common Stock,4376528441,United States,2003,642387,Finance,Life Insurance
AEL^A,American Equity Investment Life Holding Company Depositary Shares each representing a 1/1000th interest in a share of 5.95% Fixed-Rate Reset Non-Cumulative Preferred Stock Series A,,United States,,31980,,
AEL^B,American Equity Investment Life Holding Company Depositary Shares each representing a 1/1000th interest in a share of 6.625% Fixed-Rate Reset Non-Cumulative Preferred Stock Series B,,United States,,24750,,
AEM,Agnico Eagle Mines Limited Common Stock,30649923699,Canada,,3864226,,
AEMD,Aethlon Medical Inc. Common Stock,3799579,United States,,2339,Miscellaneous,Diversified Commercial Services
AENT,Alliance Entertainment Holding Corporation Class A Common Stock,106445309,United States,,16414,Consumer Discretionary,Durable Goods
AENTW,Alliance Entertainment Holding Corporation Warrants,1782577,United States,,1234,Consumer Discretionary,Durable Goods
AEO,American Eagle Outfitters Inc. Common Stock,4465595269,United States,,3243099,Consumer Discretionary,Clothing/Shoe/Accessory Stores
AEON,AEON Biopharma Inc. Class A Common Stock,268300892,United States,,44044,Health Care,Biotechnology: Pharmaceutical Preparations
AEP,American Electric Power Company Inc. Common Stock,42573594772,United States,,3136543,Utilities,Electric Utilities: Central
AER,AerCap Holdings N.V. Ordinary Shares,16705686360,Netherlands,2006,968996,Consumer Discretionary,Diversified Commercial Services
AERT,Aeries Technology Inc. Class A Ordinary Share,32956101,United States,2021,511,Consumer Discretionary,Professional Services
AERTW,Aeries Technology Inc. Warrant,796569,United States,2021,8071,Consumer Discretionary,Professional Services
AES,The AES Corporation Common Stock,11478239261,United States,,10442842,Utilities,Electric Utilities: Central
AESI,Atlas Energy Solutions Inc. Common Stock,2208564895,United States,2023,1383640,Industrials,Metal Fabrications
AEVA,Aeva Technologies Inc. Common Stock,181513028,United States,2020,256600,Consumer Discretionary,Auto Parts:O.E.M.
AEYE,AudioEye Inc. Common Stock,155665415,United States,,217277,Technology,EDP Services
AEZS,Aeterna Zentaris Inc. Common Stock,9517517,Canada,,5967,Health Care,Biotechnology: Pharmaceutical Preparations
AFAR,Aura FAT Projects Acquisition Corp Class A Ordinary Shares,0,Singapore,2022,28132,Finance,Blank Checks
AFB,AllianceBernstein National Municipal Income Fund Inc,0,United States,2002,55505,Finance,Trusts Except Educational Religious and Charitable
AFBI,Affinity Bancshares Inc. Common Stock (MD),105778113,United States,2017,498,Finance,Major Banks
AFCG,AFC Gamma Inc. Common Stock,239531619,United States,2021,113332,Real Estate,Real Estate Investment Trusts
AFG,American Financial Group Inc. Common Stock,10554758937,United States,,256818,Finance,Property-Casualty Insurers
AFGB,American Financial Group Inc. 5.875% Subordinated Debentures due 2059,1938441380,United States,2019,8506,Finance,Property-Casualty Insurers
AFGC,American Financial Group Inc. 5.125% Subordinated Debentures due 2059,1719247750,United States,2019,10818,Finance,Property-Casualty Insurers
AFGD,American Financial Group Inc. 5.625% Subordinated Debentures due 2060,1905813321,United States,2020,8135,,
AFGE,American Financial Group Inc. 4.500% Subordinated Debentures due 2060,1530172328,United States,2020,11323,,
AFIB,Acutus Medical Inc. Common Stock,5063600,United States,2020,213481,Health Care,Biotechnology: Electromedical & Electrotherapeutic Apparatus
AFJK,Aimei Health Technology Co. Ltd Ordinary Share,0,United States,2024,2609,,
AFJKR,Aimei Health Technology Co. Ltd Right,0,United States,2024,10000,,
AFJKU,Aimei Health Technology Co. Ltd Unit,0,United States,2023,3,,
AFL,AFLAC Incorporated Common Stock,46316458489,United States,,2437373,Finance,Accident &Health Insurance
AFMD,Affimed N.V.,83598772,Germany,2014,58451,Health Care,Biotechnology: Pharmaceutical Preparations
AFRI,Forafric Global PLC Ordinary Shares,276057600,Gibraltar,,3010,Consumer Staples,Packaged Foods
AFRIW,Forafric Global PLC Warrants,72264886,Gibraltar,,1303,Consumer Staples,Packaged Foods
AFRM,Affirm Holdings Inc. Class A Common Stock,9531510167,United States,2021,5158299,Consumer Discretionary,Business Services
AFT,Apollo Senior Floating Rate Fund Inc. Common Stock,0,,2011,132341,Finance,Investment Managers
AFYA,Afya Limited Class A Common Shares,1583915827,Brazil,2019,95270,Real Estate,Other Consumer Services
AG,First Majestic Silver Corp. Ordinary Shares (Canada),2151319167,Canada,,10936218,,
AGAE,Allied Gaming & Entertainment Inc. Common Stock,39280761,United States,2017,24828,Consumer Discretionary,Services-Misc. Amusement & Recreation
AGBA,AGBA Group Holding Limited Ordinary Share,31028635,Hong Kong,2019,326722,Finance,Investment Managers
AGBAW,AGBA Group Holding Limited Warrant,1041479,Hong Kong,2019,2705,Finance,Investment Managers
AGCO,AGCO Corporation Common Stock,8807893847,United States,,693137,Industrials,Industrial Machinery/Components
AGD,abrdn Global Dynamic Dividend Fund Common Shares of Beneficial Interest,0,United States,2006,69373,Finance,Trusts Except Educational Religious and Charitable
AGEN,Agenus Inc. Common Stock,136149026,United States,2000,1457491,Health Care,Biotechnology: Biological Products (No Diagnostic Substances)
AGFY,Agrify Corporation Common Stock,493190,United States,2021,648525,Consumer Discretionary,Military/Government/Technical
AGI,Alamos Gold Inc. Class A Common Shares,5947594877,Canada,2015,3895799,Basic Materials,Precious Metals
AGIO,Agios Pharmaceuticals Inc. Common Stock,1644261223,United States,2013,617987,Health Care,Biotechnology: Pharmaceutical Preparations
AGL,agilon health inc. Common Stock,1826555821,United States,2021,5916013,Health Care,Managed Health Care
AGM,Federal Agricultural Mortgage Corporation Common Stock,1944881970,United States,,42024,Finance,Finance Companies
AGM^C,Federal Agricultural Mortgage Corporation Preferred Series C Fixed to Fltg,,United States,,12159,,
AGM^D,Federal Agricultural Mortgage Corporation 5.700% Non-Cumulative Preferred Stock Series D,,United States,,9291,,
AGM^E,Federal Agricultural Mortgage Corporation 5.750% Non-Cumulative Preferred Stock Series E,,United States,,2467,,
AGM^F,Federal Agricultural Mortgage Corporation 5.250% Non-Cumulative Preferred Stock Series F,,United States,,11352,,
AGM^G,Federal Agricultural Mortgage Corporation 4.875% Non-Cumulative Preferred Stock Series G,,United States,,8627,,
AGMH,AGM Group Holdings Inc. Class A Ordinary Shares,42167747,Hong Kong,2018,168207,Technology,EDP Services
AGNC,AGNC Investment Corp. Common Stock,6345488237,United States,2008,13499516,Real Estate,Real Estate Investment Trusts
AGNCL,AGNC Investment Corp. Depositary Shares Each Representing a 1/1000th Interest in a Share of 7.75% Series G Fixed-Rate Reset Cumulative Redeemable Preferred Stock,155250,United States,,56545,Real Estate,Real Estate Investment Trusts
AGNCM,AGNC Investment Corp. Depositary Shares rep 6.875% Series D Fixed-to-Floating Cumulative Redeemable Preferred Stock,11807228720,United States,,53110,Real Estate,Real Estate Investment Trusts
AGNCN,AGNC Investment Corp. Depositary Shares Each Representing a 1/1000th Interest in a Share of 7.00% Series C Fixed-To-Floating Rate Cumulative Redeemable Preferred Stock,12060479680,United States,,36824,Real Estate,Real Estate Investment Trusts
AGNCO,AGNC Investment Corp. Depositary Shares each representing a 1/1000th interest in a share of 6.50% Series E Fixed-to-Floating Cumulative Redeemable Preferred Stock,388654,United States,,76618,Real Estate,Real Estate Investment Trusts
AGNCP,AGNC Investment Corp. Depositary Shares Each Representing a 1/1000th Interest in a Share of 6.125% Series F Fixed-to-Floating Rate Cumulative Redeemable Preferred Stock,538200,United States,,108559,Real Estate,Real Estate Investment Trusts
AGO,Assured Guaranty Ltd. Common Stock,4372040529,Bermuda,2004,489646,Finance,Property-Casualty Insurers
AGR,Avangrid Inc. Common Stock,13900871367,United States,2015,1113237,Utilities,Electric Utilities: Central
AGRI,AgriFORCE  Growing Systems Ltd. Common Shares,3609573,Canada,2021,1273685,Industrials,Metal Fabrications
AGRIW,AgriFORCE  Growing Systems Ltd. Warrant,205423,Canada,2021,1267,Industrials,Metal Fabrications
AGRO,Adecoagro S.A. Common Shares,1166301330,Luxembourg,2011,435988,Consumer Staples,Farming/Seeds/Milling
AGS,PlayAGS Inc. Common Stock,347903211,United States,2018,158321,Consumer Discretionary,Miscellaneous manufacturing industries
AGTI,Agiliti Inc. Common Stock,1361948580,United States,2021,6895389,Health Care,Managed Health Care
AGX,Argan Inc. Common Stock,787257595,United States,,247214,Consumer Discretionary,Engineering & Construction
AGYS,Agilysys Inc. Common Stock (DE),2265117869,United States,,149399,Technology,EDP Services
AHCO,AdaptHealth Corp. Common Stock,1313122178,United States,2018,763833,Health Care,Medical/Nursing Services
AHG,Akso Health Group ADS,86846434,China,2017,22544,Consumer Discretionary,Business Services
AHH,Armada Hoffler Properties Inc. Common Stock,679287332,United States,2013,479209,Finance,Real Estate
AHH^A,Armada Hoffler Properties Inc. 6.75% Series A Cumulative Redeemable Perpetual Preferred Stock,,United States,,14532,,
