Symbol,Name,Market Cap,Country,IPO Year,Volume,Sector,Industry
JBT,John Bean Technologies Corporation Common Stock,2958494842,United States,,291248,Industrials,Industrial Machinery/Components
JCE,Nuveen Core Equity Alpha Fund Common Shares of Beneficial Interest,0,United States,2007,36604,Finance,Trusts Except Educational Religious and Charitable
JCI,Johnson Controls International plc Ordinary Share,43887121762,Switzerland,,3384446,Industrials,Industrial Machinery/Components
JCSE,JE Cleantech Holdings Limited Ordinary Shares,3544720,Singapore,2022,1051,Consumer Discretionary,Miscellaneous manufacturing industries
JCTCF,Jewett-Cameron Trading Company Common Shares,19101171,United States,,5556,Consumer Discretionary,RETAIL: Building Materials
JD,JD.com Inc. American Depositary Shares,39947745104,China,2014,10544989,Consumer Discretionary,Other Specialty Stores
JEF,Jefferies Financial Group Inc. Common Stock,8757399028,United States,,752377,Finance,Investment Bankers/Brokers/Service
JELD,JELD-WEN Holding Inc. Common Stock,1645580290,United States,2017,477482,Basic Materials,Forest Products
JEQ,abrdn Japan Equity Fund Inc. Common Stock,81191940,United States,1992,21562,Consumer Discretionary,Air Freight/Delivery Services
JEWL,Adamas One Corp. Common Stock,10083427,United States,2022,23679,Consumer Discretionary,Consumer Specialties
JFBR,Jeffs' Brands Ltd Ordinary Shares,377416,Israel,2022,81265,Consumer Discretionary,Other Specialty Stores
JFBRW,Jeffs' Brands Ltd Warrant,78765,Israel,2022,1198,Consumer Discretionary,Other Specialty Stores
JFIN,Jiayin Group Inc. American Depositary Shares,344101120,China,2019,52423,Finance,Finance: Consumer Services
JFR,Nuveen Floating Rate Income Fund Common Stock,0,United States,2004,1107874,Finance,Trusts Except Educational Religious and Charitable
JFU,9F Inc. American Depositary Shares,36968266,China,2019,1565,Finance,Finance: Consumer Services
JG,Aurora Mobile Limited American Depositary Shares,18180750,China,2018,1061,Technology,Computer Software: Programming Data Processing
JGH,Nuveen Global High Income Fund Common Shares of Beneficial Interest,0,United States,2014,49232,Finance,Investment Managers
JHG,Janus Henderson Group plc Ordinary Shares,5046103109,United Kingdom,2017,712185,Finance,Investment Managers
JHI,John Hancock Investors Trust Common Stock,113679111,United States,,13770,Finance,Trusts Except Educational Religious and Charitable
JHS,John Hancock Income Securities Trust Common Stock,124851391,United States,,18646,Finance,Finance Companies
JHX,James Hardie Industries plc American Depositary Shares (Ireland),15971493974,Ireland,,19131,Industrials,Building Materials
JILL,J. Jill Inc. Common Stock,271318362,United States,2017,47674,Consumer Discretionary,Apparel
JJSF,J & J Snack Foods Corp. Common Stock,2604651437,United States,1986,72637,Consumer Staples,Specialty Foods
JKHY,Jack Henry & Associates Inc. Common Stock,12026081577,United States,1985,287193,Technology,EDP Services
JKS,JinkoSolar Holding Company Limited American Depositary Shares (each representing 4 Common Shares),1146306603,China,2010,719524,Technology,Semiconductors
JL,J-Long Group Limited Ordinary Shares,19260760,Hong Kong,2024,2024773,,
JLL,Jones Lang LaSalle Incorporated Common Stock,8362234967,United States,,192894,Finance,Real Estate
JLS,Nuveen Mortgage and Income Fund,0,United States,2009,18970,Finance,Investment Managers
JMIA,Jumia Technologies AG American Depositary Shares each representing two Ordinary Shares,418714148,,2019,3143647,Consumer Discretionary,Catalog/Specialty Distribution
JMM,Nuveen Multi-Market Income Fund (MA),0,United States,,727,Finance,Trusts Except Educational Religious and Charitable
JMSB,John Marshall Bancorp Inc. Common Stock,219793854,United States,,12114,Finance,Major Banks
JNJ,Johnson & Johnson Common Stock,3.5551E+11,United States,,8493872,Health Care,Biotechnology: Pharmaceutical Preparations
JNPR,Juniper Networks Inc. Common Stock,11756057006,United States,1999,2460116,Technology,Computer peripheral equipment
JNVR,Janover Inc. Common Stock,12281679,United States,2023,4306,Finance,Finance: Consumer Services
JOB,GEE Group Inc. Common Stock,36873565,United States,1968,305877,Consumer Discretionary,Diversified Commercial Services
JOBY,Joby Aviation Inc. Common Stock,3289371219,United States,2020,4222546,Consumer Discretionary,Aerospace
JOE,St. Joe Company (The) Common Stock,3288097013,United States,,200666,Real Estate,Homebuilding
JOF,Japan Smaller Capitalization Fund Inc Common Stock,0,United States,1990,145239,Finance,Trusts Except Educational Religious and Charitable
JOUT,Johnson Outdoors Inc. Class A Common Stock,439524825,United States,,52248,Consumer Discretionary,Recreational Games/Products/Toys
JPC,Nuveen Preferred & Income Opportunities Fund,0,United States,2003,1012893,Finance,Investment Managers
JPI,Nuveen Preferred and Income Term Fund Common Shares of Beneficial Interest,426982856,,2012,110224,Finance,Finance Companies
JPM,JP Morgan Chase & Co. Common Stock,5.26791E+11,United States,,14758165,Finance,Major Banks
JPM^C,J P Morgan Chase & Co Depositary Shares each representing a 1/400th interest in a share of 6.00% Non-Cumulative  Preferred Stock Series EE,,United States,,154899,,
JPM^D,J P Morgan Chase & Co Depositary Shares each representing a 1/400th  interest in a share of 5.75% Non-Cumulative  Preferred Stock Series DD,,United States,,138684,,
JPM^J,J P Morgan Chase & Co Depositary Shares each representing a 1/400th interest in a share of JPMorgan Chase & Co. 4.75% Non-Cumulative Preferred Stock Series GG,,United States,,74638,,
JPM^K,J P Morgan Chase & Co Depositary Shares each representing a 1/400th interest in a share of 4.55% Non-Cumulative Preferred Stock Series JJ,,United States,,107739,,
JPM^L,J P Morgan Chase & Co Depositary Shares each representing a 1/400th interest in a share of 4.625% Non-Cumulative Preferred Stock Series LL,,United States,,119446,,
JPM^M,J P Morgan Chase & Co Depositary Shares each representing a 1/400th interest in a share of 4.20% Non-Cumulative Preferred Stock Series MM,,United States,,197043,,
JQC,Nuveen Credit Strategies Income Fund Shares of Beneficial Interest,0,United States,2003,967721,Finance,Finance Companies
JRI,Nuveen Real Asset Income and Growth Fund Common Shares of Beneficial Interest,0,United States,2012,122444,Finance,Finance Companies
JRS,Nuveen Real Estate Income Fund Common Shares of Beneficial Interest,0,United States,2001,202910,Finance,Finance/Investors Services
JRSH,Jerash Holdings (US) Inc. Common Stock,36638623,United States,2018,15708,Consumer Discretionary,Apparel
JRVR,James River Group Holdings Ltd. Common Shares,322746911,Bermuda,2014,486327,Finance,Property-Casualty Insurers
JSM,Navient Corporation 6% Senior Notes due December 15 2043,2154650283,United States,,27265,Finance,Finance: Consumer Services
JSPR,Jasper Therapeutics Inc. Common Stock,396180465,United States,2020,107347,Health Care,Biotechnology: Biological Products (No Diagnostic Substances)
JSPRW,Japer Therapeutics Inc. Warrants,2545798,United States,2020,5261,Health Care,Biotechnology: Biological Products (No Diagnostic Substances)
JTAI,Jet.AI Inc. Common Stock,9562730,Cayman Islands,2021,171547,Finance,Blank Checks
JTAIW,Jet.AI Inc. Warrant,0,Cayman Islands,2021,1623,Finance,Blank Checks
JTAIZ,Jet.AI Inc. Merger Consideration Warrants,3783595,Cayman Islands,,2271,,
JVA,Coffee Holding Co. Inc. Common Stock,10218392,United States,2005,237935,Consumer Staples,Packaged Foods
JVSA,JV SPAC Acquisition Corp. Class A Ordinary Share,0,China,2024,65333,,
JVSAU,JVSPAC Acquisition Corp. Unit,0,China,2024,240,,
JWEL,Jowell Global Ltd. Ordinary Shares,2282080,China,2021,7419,Consumer Discretionary,Other Consumer Services
JWN,Nordstrom Inc. Common Stock,2901098534,United States,,4754560,Consumer Discretionary,Clothing/Shoe/Accessory Stores
JWSM,Jaws Mustang Acquisition Corp. Class A Ordinary Shares,0,,2021,41,Finance,Blank Checks
JXJT,JX Luxventure Limited Common Stock,7968900,China,2013,30977,Consumer Staples,Apparel
JXN,Jackson Financial Inc. Class A Common Stock ,4966771307,United States,2021,697161,Finance,Life Insurance
JXN^A,Jackson Financial Inc. Depositary Shares each representing a 1/1000th interest in a share of Fixed-Rate Reset Noncumulative Perpetual Preferred Stock Series A,,United States,,75276,,
JYD,Jayud Global Logistics Limited Class A Ordinary Shares,20708625,China,2023,19107,Consumer Discretionary,Oil Refining/Marketing
JYNT,The Joint Corp. Common Stock,177314916,United States,2014,69572,Miscellaneous,Multi-Sector Companies
JZ,Jianzhi Education Technology Group Company Limited American Depositary Shs,44840978,China,2022,7399,Real Estate,Other Consumer Services
JZXN,Jiuzi Holdings Inc. Ordinary Shares,1139895,China,2021,436503,Consumer Discretionary,Retail-Auto Dealers and Gas Stations
K,Kellanova Common Stock,18873575881,United States,,1655499,Consumer Staples,Packaged Foods
KA,Kineta Inc. Common Stock,3727236,United States,2016,167378,Health Care,Biotechnology: Pharmaceutical Preparations
KACL,Kairous Acquisition Corp. Limited Ordinary Shares,0,Malaysia,2022,4052,Finance,Blank Checks
KACLW,Kairous Acquisition Corp. Limited Warrants,0,Malaysia,2022,51399,Finance,Blank Checks
KAI,Kadant Inc Common Stock,3409235623,United States,1992,45019,Industrials,Industrial Machinery/Components
KALA,KALA BIO Inc. Common Stock,19715178,United States,2017,23989,Health Care,Biotechnology: Pharmaceutical Preparations
KALU,Kaiser Aluminum Corporation Common Stock,1422682715,United States,,137199,Industrials,Metal Fabrications
KALV,KalVista Pharmaceuticals Inc. Common Stock,495290595,United Kingdom,2015,313460,Health Care,Biotechnology: Pharmaceutical Preparations
KAMN,Kaman Corporation Common Stock,1298715577,United States,,135986,Industrials,Military/Government/Technical
KAR,OPENLANE Inc. Common Stock,1885395005,United States,2009,743431,Consumer Discretionary,Retail-Auto Dealers and Gas Stations
KARO,Karooooo Ltd. Ordinary Shares,835679862,Singapore,2021,5705,Technology,Computer Software: Prepackaged Software
KAVL,Kaival Brands Innovations Group Inc. Common Stock,18036913,United States,,44226205,Health Care, Medicinal Chemicals and Botanical Products 
KB,KB Financial Group Inc,18363466209,South Korea,,97074,Finance,Commercial Banks
KBH,KB Home Common Stock,4793286044,United States,1986,1064784,Consumer Discretionary,Homebuilding
KBR,KBR Inc. Common Stock,8331212649,United States,2006,1150184,Industrials,Military/Government/Technical
KC,Kingsoft Cloud Holdings Limited American Depositary Shares,657045841,China,2020,1049828,Technology,Computer Software: Prepackaged Software
KCGI,Kensington Capital Acquisition Corp. V Class A Ordinary Shares,0,,2021,59736,Finance,Blank Checks
KD,Kyndryl Holdings Inc. Common Stock,4618174194,United States,2021,1400382,Technology,EDP Services
KDP,Keurig Dr Pepper Inc. Common Stock,42224394434,United States,,10276803,Consumer Staples,Beverages (Production/Distribution)
KE,Kimball Electronics Inc. Common Stock,512803028,United States,,92899,Technology,Electrical Products
KELYA,Kelly Services Inc. Class A Common Stock,819048615,United States,,118870,Consumer Discretionary,Professional Services
KELYB,Kelly Services Inc. Class B Common Stock,829635198,United States,,29,Consumer Discretionary,Professional Services
KEN,Kenon Holdings Ltd. Ordinary Shares,1037376513,Singapore,2015,28160,Utilities,Electric Utilities: Central
KEP,Korea Electric Power Corporation Common Stock,9629461155,South Korea,1994,171247,Utilities,Electric Utilities: Central
KEQU,Kewaunee Scientific Corporation Common Stock,100197374,United States,,8350,Industrials,Medical Specialities
KEX,Kirby Corporation Common Stock,5684827080,United States,,360905,Consumer Discretionary,Marine Transportation
KEY,KeyCorp Common Stock,13475335616,United States,,15555428,Finance,Major Banks
KEY^I,KeyCorp Depositary Shares Each Representing a 1/40th Ownership Interest in a Share of Fixed-to-Floating Rate Perpetual Non-Cumulative Preferred Stock Series E,,United States,,85979,,
KEY^J,KeyCorp Depositary Shares each representing a 1/40th ownership interest in a share of Fixed Rate Perpetual Non-Cumulative Preferred Stock Series F,,United States,,85339,,
KEY^K,KeyCorp Depositary Shares each representing a 1/40th ownership interest in a share of Fixed Rate Perpetual Non-Cumulative Preferred Stock Series G,,United States,,70485,,
KEY^L,KeyCorp Depositary Shares each representing a 1/40th ownership interest in a share of Fixed Rate Perpetual Non-Cumulative Preferred Stock Series H,,United States,,136391,,
KEYS,Keysight Technologies Inc. Common Stock,26762901695,United States,2014,1082939,Industrials,Industrial Machinery/Components
KF,Korea Fund Inc. (The) New Common Stock,0,United States,,15353,Finance,Investment Managers
KFFB,Kentucky First Federal Bancorp Common Stock,30729517,United States,2005,226,Finance,Savings Institutions
KFRC,Kforce Inc. Common Stock,1258130280,United States,1995,74317,Consumer Discretionary,Professional Services
KFS,Kingsway Financial Services Inc. Common Stock (DE),239312016,Canada,,26659,Finance,Property-Casualty Insurers
KFY,Korn Ferry Common Stock,3174645741,United States,1999,203217,Consumer Discretionary,Diversified Commercial Services
KGC,Kinross Gold Corporation Common Stock,7877779113,Canada,2001,20155438,,
KGEI,Kolibri Global Energy Inc. Common stock,120770740,United States,,9031,Energy,Oil & Gas Production
KGS,Kodiak Gas Services Inc. Common Stock,2062082786,United States,2023,322742,,
KHC,The Kraft Heinz Company Common Stock,44047653266,United States,,6990503,Consumer Staples,Packaged Foods
KIDS,OrthoPediatrics Corp. Common Stock,717082153,United States,2017,425473,Health Care,Medical/Dental Instruments
KIM,Kimco Realty Corporation (HC) Common Stock,12139196819,United States,,4971223,Real Estate,Real Estate Investment Trusts
KIM^L,Kimco Realty Corporation Class L Depositary Shares each of which represents a one-one thousandth fractional interest in a share of 5.125% Class L Cumulative Redeemable Preferred Stock liquidation preference $25000.00 per share,,United States,,14509,,
KIM^M,Kimco Realty Corporation Class M Depositary Shares each of which represents a one-one thousandth fractional interest in a share of 5.25% Class M Cumulative Redeemable Preferred Stock liquidation preference $25000.00 per share,,United States,,13927,,
KIM^N,Kimco Realty Corporation Depositary Shares each representing 1/1000th interest in a share of 7.25% Class N Cumulative Convertible Perpetual Preferred Stock,,United States,,1830,,
KIND,Nextdoor Holdings Inc. Class A Common Stock,771516552,United States,,1628283,Technology,Computer Software: Programming Data Processing
KINS,Kingstone Companies Inc. Common Stock,45242157,United States,,13116,Finance,Specialty Insurers
KIO,KKR Income Opportunities Fund Common Shares,0,,2013,244332,Finance,Investment Managers
KIRK,Kirkland's Inc. COMMONSTOCK,28049468,United States,2002,85914,Consumer Discretionary,Other Specialty Stores
KITT,Nauticus Robotics Inc. Common stock,14156500,United States,2021,478208,Industrials,Industrial Machinery/Components
KITTW,Nauticus Robotics Inc. Warrant,1844070,United States,2021,5901,Industrials,Industrial Machinery/Components
KKR,KKR & Co. Inc. Common Stock,84819231508,United States,,3350287,Finance,Investment Managers
KKRS,KKR Group Finance Co. IX LLC 4.625% Subordinated Notes due 2061,16567362415,United States,2021,49623,,
KLAC,KLA Corporation Common Stock,91754679867,United States,1980,885598,Technology,Electronic Components
KLG,WK Kellogg Co Common Stock,1799594674,United States,2023,1061461,Consumer Staples,Packaged Foods
KLIC,Kulicke and Soffa Industries Inc. Common Stock,2675075760,Singapore,,309257,Technology,Semiconductors
KLTR,Kaltura Inc. Common Stock,171909752,United States,2021,159111,Technology,EDP Services
KLXE,KLX Energy Services Holdings Inc. Common Stock,127256840,United States,,386703,Energy,Oilfield Services/Equipment
KMB,Kimberly-Clark Corporation Common Stock,42245153029,United States,,2340786,Consumer Discretionary,Containers/Packaging
KMDA,Kamada Ltd. Ordinary Shares,229580800,Israel,2013,11040,Health Care,Biotechnology: Pharmaceutical Preparations
KMI,Kinder Morgan Inc. Common Stock,39882078361,United States,2011,10025424,Utilities,Natural Gas Distribution
KMPB,Kemper Corporation 5.875% Fixed-Rate Reset Junior Subordinated Debentures due 2062,1404829455,United States,2022,28427,Finance,Property-Casualty Insurers
KMPR,Kemper Corporation,3519149244,United States,,359094,Finance,Property-Casualty Insurers
KMT,Kennametal Inc. Common Stock,1892169696,United States,,804964,Industrials,Industrial Machinery/Components
KMX,CarMax Inc,10969207177,United States,,3637904,Consumer Discretionary,Retail-Auto Dealers and Gas Stations
KN,Knowles Corporation Common Stock,1395536998,United States,2014,456691,Consumer Staples,Consumer Electronics/Appliances
KNDI,Kandi Technologies Group Inc Common Stock,188693785,China,,145067,Consumer Discretionary,Auto Manufacturing
KNF,Knife Riv Holding Co. Common Stock,4556824819,United States,2023,257546,,
KNOP,KNOT Offshore Partners LP Common Units representing Limited Partner Interests,172608561,United Kingdom,2013,59937,Consumer Discretionary,Marine Transportation
KNSA,Kiniksa Pharmaceuticals Ltd. Class A Common Stock,1231525984,United States,2018,314106,Health Care,Biotechnology: Pharmaceutical Preparations
KNSL,Kinsale Capital Group Inc. Common Stock,10371786521,United States,,113962,Finance,Property-Casualty Insurers
KNTK,Kinetik Holdings Inc. Class A Common Stock,5795731883,United States,2022,524392,Utilities,Natural Gas Distribution
KNW,Know Labs Inc. Common Stock,51248310,,2022,58788,Industrials,Industrial Machinery/Components
KNX,Knight-Swift Transportation Holdings Inc.,8189476750,United States,2017,1091939,Industrials,Trucking Freight/Courier Services
KO,Coca-Cola Company (The) Common Stock,2.50726E+11,United States,,12423111,Consumer Staples,Beverages (Production/Distribution)
KOD,Kodiak Sciences Inc Common Stock,203208290,United States,2018,583301,Health Care,Biotechnology: Biological Products (No Diagnostic Substances)
KODK,Eastman Kodak Company Common New,362746000,United States,,743536,Consumer Discretionary,Business Services
KOF,Coca Cola Femsa S.A.B. de C.V.  American Depositary Shares each representing 10 Units (each Unit consists of 3 Series B Shares and 5 Series L Shares),19913788993,Mexico,1993,200122,Consumer Staples,Beverages (Production/Distribution)
KOP,Koppers Holdings Inc. Common Stock,1171259043,United States,2006,144855,Basic Materials,Forest Products
KOPN,Kopin Corporation Common Stock,168167764,United States,1992,1317407,Technology,Semiconductors
KORE,KORE Group Holdings Inc. Common Stock,66333595,United States,,19597,Consumer Discretionary,Telecommunications Equipment
KOS,Kosmos Energy Ltd. Common Shares (DE),2852590385,Bermuda,2011,6683914,Energy,Oil & Gas Production
KOSS,Koss Corporation Common Stock,21517398,United States,,42261,Consumer Staples,Consumer Electronics/Appliances
KPLT,Katapult Holdings Inc. Common Stock,36667879,United States,2019,2893,Consumer Discretionary,Diversified Commercial Services
KPLTW,Katapult Holdings Inc. Warrant,75612,United States,2019,200,Consumer Discretionary,Diversified Commercial Services
KPRX,Kiora Pharmaceuticals Inc.  Common Stock,14703470,United States,,45121,Health Care,Biotechnology: Pharmaceutical Preparations
KPTI,Karyopharm Therapeutics Inc. Common Stock,132902481,United States,2013,810557,Miscellaneous,Diversified Commercial Services
KR,Kroger Company (The) Common Stock,39952639044,United States,,4228060,Consumer Staples,Food Chains
KRC,Kilroy Realty Corporation Common Stock,3865905210,United States,1997,869235,Real Estate,Real Estate Investment Trusts
KREF,KKR Real Estate Finance Trust Inc. Common Stock,665413056,United States,2017,732589,Real Estate,Real Estate Investment Trusts
KREF^A,KKR Real Estate Finance Trust Inc. 6.50% Series A Cumulative Redeemable Preferred Stock,,United States,,28362,,
KRG,Kite Realty Group Trust Common Stock,4393357549,United States,2004,1002284,Real Estate,Real Estate Investment Trusts
KRKR,36Kr Holdings Inc. American Depositary Shares,14620925,China,2019,24156,Consumer Discretionary,Business Services
KRMD,KORU Medical Systems Inc. Common Stock (DE),95077840,United States,,107307,Health Care,Medical/Dental Instruments
KRNL,Kernel Group Holdings Inc. Class A Ordinary Shares,0,United States,2021,306,Finance,Blank Checks
KRNLW,Kernel Group Holdings Inc. Warrants,0,United States,2021,10810,Finance,Blank Checks
KRNT,Kornit Digital Ltd. Ordinary Shares,762559735,Israel,2015,252663,Industrials,Industrial Machinery/Components
KRNY,Kearny Financial Corp Common Stock,362780282,United States,2005,354954,Finance,Savings Institutions
KRO,Kronos Worldwide Inc Common Stock,1320510144,United States,,219789,Industrials,Major Chemicals
KRON,Kronos Bio Inc. Common Stock,68508315,United States,2020,67186,Health Care, Medicinal Chemicals and Botanical Products 
KROS,Keros Therapeutics Inc. Common Stock,2075477983,United States,2020,209800,Health Care,Biotechnology: Pharmaceutical Preparations
KRP,Kimbell Royalty Partners Common Units Representing Limited Partner Interests,1504763185,United States,2017,273189,Energy,Oil & Gas Production
KRRO,Korro Bio Inc. Common Stock,596592124,United States,2019,12857,Health Care,Biotechnology: Pharmaceutical Preparations
KRT,Karat Packaging Inc. Common Stock,544637258,United States,2021,61862,Industrials,Plastic Products
KRUS,Kura Sushi USA Inc. Class A Common Stock,1235939966,United States,2019,133660,Consumer Discretionary,Restaurants
KRYS,Krystal Biotech Inc. Common Stock,4802671566,United States,2017,288030,Health Care,Biotechnology: Biological Products (No Diagnostic Substances)
KSCP,Knightscope Inc. Class A Common Stock,51950049,United States,2022,1139511,Telecommunications,Telecommunications Equipment
KSM,DWS Strategic Municipal Income Trust,0,United States,1989,16152,Finance,Trusts Except Educational Religious and Charitable
KSPI,Joint Stock Company Kaspi.kz American Depository Shares,21059561312,Kazakhstan,2024,223114,,
KSS,Kohl's Corporation Common Stock,2465457653,United States,1992,5716631,Consumer Discretionary,Department/Specialty Retail Stores
KT,KT Corporation Common Stock,6380583536,South Korea,,1248998,Telecommunications,Telecommunications Equipment
KTB,Kontoor Brands Inc. Common Stock ,3011020128,United States,2019,364985,Consumer Discretionary,Apparel
KTCC,Key Tronic Corporation Common Stock,48428420,United States,1983,14388,Technology,Electrical Products
KTF,DWS Municipal Income Trust,369728780,United States,1988,47414,Finance,Finance Companies
KTH,Structures Products Cp 8% CorTS Issued by Peco Energy Cap Tr II Preferred Stock,0,United States,,948,Finance,Investment Managers
KTN,Structured Products Corp 8.205% CorTS 8.205% Corporate Backed Trust Securities (CorTS),0,United States,,1679,Finance,Finance: Consumer Services
KTOS,Kratos Defense & Security Solutions Inc. Common Stock,2306154603,United States,,1454868,Industrials,Military/Government/Technical
KTRA,Kintara Therapeutics Inc. Common Stock,4298073,United States,,2622085,Health Care,Biotechnology: Pharmaceutical Preparations
KTTA,Pasithea Therapeutics Corp. Common Stock,7453267,United States,2021,1569,Health Care,Biotechnology: Pharmaceutical Preparations
KUKE,Kuke Music Holding Limited American Depositary Shares each representing one Ordinary Share,70585425,,2021,517010,Real Estate,Other Consumer Services
KULR,KULR Technology Group Inc. Common Stock,74454457,United States,,11392391,Technology,Electrical Products
KURA,Kura Oncology Inc. Common Stock,1447363667,United States,,751803,Health Care,Biotechnology: Pharmaceutical Preparations
KVAC,Keen Vision Acquisition Corporation Ordinary Shares,0,United States,2023,4865,,
KVACU,Keen Vision Acquisition Corporation Units,0,United States,2023,3109,,
KVACW,Keen Vision Acquisition Corporation Warrant,0,United States,2023,34850,,
KVHI,KVH Industries Inc. Common Stock,103337676,United States,1996,147559,Technology,Radio And Television Broadcasting And Communications Equipment
KVUE,Kenvue Inc. Common Stock,36625950810,United States,2023,13423358,Consumer Discretionary,Specialty Chemicals
KVYO,Klaviyo Inc. Series A Common Stock,6128562050,United States,2023,771262,,
KW,Kennedy-Wilson Holdings Inc. Common Stock,1136837570,United States,,1408370,Finance,Real Estate
KWE,KWESST Micro Systems Inc. Common Stock,4081699,Canada,,56981,,
KWESW,KWESST Micro Systems Inc. Warrant,1295477,Canada,,6,Technology,Computer Software: Prepackaged Software
KWR,Quaker Houghton Common Stock,3455500883,United States,,153305,Industrials,Major Chemicals
KXIN,Kaixin Holdings Ordinary Shares,3971107,China,2017,692146,Consumer Discretionary,Retail-Auto Dealers and Gas Stations
KYMR,Kymera Therapeutics Inc. Common Stock,2101630606,United States,2020,528869,Health Care, Medicinal Chemicals and Botanical Products 
KYN,Kayne Anderson Energy Infrastructure Fund Inc.,1275552436,United States,2004,773773,Finance,Finance/Investors Services
KYTX,Kyverna Therapeutics Inc. Common Stock,986907935,United States,2024,177892,,
KZIA,Kazia Therapeutics Limited American Depositary Shares,7000494,Australia,,455770,Health Care,Biotechnology: Pharmaceutical Preparations
KZR,Kezar Life Sciences Inc. Common Stock,58932700,United States,2018,578218,Health Care,Biotechnology: Pharmaceutical Preparations
L,Loews Corporation Common Stock,16318451648,United States,,724649,Finance,Property-Casualty Insurers
LAAC,Lithium Americas (Argentina) Corp. Common Shares,829974420,Canada,2023,1548402,,
LAB,Standard BioTools Inc. Common Stock,1059417671,United States,2011,2170470,Industrials,Biotechnology: Laboratory Analytical Instruments
